sentence1,sentence2,similarity
Low expectations for Iran nuclear talks,A dog in a colored coat is running across the yard,0.14903623
terminal 1 and terminal 2 possess no difference,this sound like a very bad idea .,0.171202
Ten people riding ATVs.,how do i maintain a good relationship with my old boss after being promoted ?,0.18015052
ubs settles us mortgage lawsuit,if the bulb is contained in a closed path with a switch,0.18399528
last year he was wanted for murder .,terminal 1 and terminal 2 possess no difference,0.18659234
russia ratified the amended version of the treaty .,this sound like a very bad idea .,0.18844366
terminal 1 and terminal 2 possess no difference,A little boy is watching a family that is hitting a baseball,0.18863298
Low expectations for Iran nuclear talks,"A dog, which is large and gray, is carrying a ball in its mouth and running across the grass",0.18894207
myanmar was formerly called burma .,a woman is peeling an orange .,0.1891525
three dogs swim in the water .,how do i maintain a good relationship with my old boss after being promoted ?,0.1911619
A man is removing vegetables from a pot,"yes , i can tell you from personal experience that they certainly did whistle .",0.19269785
the girl wearing a blue shirt is running through a science center .,how do i maintain a good relationship with my old boss after being promoted ?,0.19320482
Low expectations for Iran nuclear talks,red double decker bus driving through the streets .,0.19497542
Five people are standing in the grass with no dogs,how do i maintain a good relationship with my old boss after being promoted ?,0.19735977
faa continues ban on us flights to tel aviv,man with pink shirt sleeping on chair with infant .,0.19806163
A man sitting in a back yard playing the guitar.,"the russia of putin has already lost 12 prominent journalists , murdered during the last six years .",0.19810542
terminal 1 and terminal 2 possess no difference,Someone is falling off the horse,0.19926333
the commerce commission would have been a significant hurdle for such a deal .,A man is slicing tomatoes,0.19960171
algeria hostage death toll rises,if the bulb is contained in a closed path with a switch,0.1996154
You are making this too complicated.,aid workers freed in afghanistan raid,0.20098147
An old man is talking to a leaf,us state department faulted over benghazi,0.20174241
terminal 1 and terminal 2 possess no difference,"the russia of putin has already lost 12 prominent journalists , murdered during the last six years .",0.20224291
how do i maintain a good relationship with my old boss after being promoted ?,four kids holding hands jump into a swimming pool .,0.2024529
algeria mulls international force for hostages,A man sitting in a back yard playing the guitar.,0.20258325
this sound like a very bad idea .,"and what do you know , receipts stayed about the same .",0.20282935
two brown horses standing in grassy field .,bomb attacks kill 20 in baghdad 's christian areas,0.20308803
Someone is falling off the horse,"currently i 've got a fairly close to purely digital gtd setup , although this could do with some refinements and tweaks .",0.20350368
A man sitting in a back yard playing the guitar.,iran steps up sensitive nuclear work - iaea,0.20394547
three dogs swim in the water .,"i don 't know if i should say this , but if your job is making you anxious .",0.20404422
Low expectations for Iran nuclear talks,A brown and white dog is running across a brown field.,0.20423809
A woman is cleaning a shrimp,obama urges no new sanctions on iran,0.20511603
a man with a bicycle at a coffee house .,"us , nato raise doubts russia pulled back from ukraine border",0.20542943
A dog in a colored coat is running across the yard,obama urges no new sanctions on iran,0.20583552
"the value will total about $ 124 million , including convertible securities , according to corel .",There is no woman cutting an onion,0.20636302
three dogs swim in the water .,how can i build a wall mounted adjustable height desk ?,0.20650296
a man with a bicycle at a coffee house .,"as a result , murphy sought to substitute strier 's sister , ethel celnik , as the trustee .",0.20737284
a dog laying in a pet jacket .,how do i maintain a good relationship with my old boss after being promoted ?,0.20743479
AbbVie Sours on $55B Shire Deal After Tax Changes,a man is playing a keyboard piano .,0.20752393
Low expectations for Iran nuclear talks,how can i repair a towel bar with one end ripped out of the wall ?,0.20770858
so what does this have to do with newt ?,bomb blast kills 10 in southwest pakistan,0.20837176
terminal 1 and terminal 2 possess no difference,several people are sitting around a fire at night .,0.20954672
two brown horses standing in grassy field .,ubs settles us mortgage lawsuit,0.20972261
bomb blast kills 10 in southwest pakistan,a bald man with a beard pets the nose of a black and white horse at the fence .,0.2099568
aid workers freed in afghanistan raid,how can i build a wall mounted adjustable height desk ?,0.21005437
holder filed a three-page letter .,i like watching kids play .,0.21008973
two brown horses standing in grassy field .,obama urges no new sanctions on iran,0.21011227
the brown dog is laying down on a blue sheet .,how do i maintain a good relationship with my old boss after being promoted ?,0.21024743
algeria hostage death toll rises,A man sitting in a back yard playing the guitar.,0.2105319
terminal 1 and terminal 2 possess no difference,ubs settles us mortgage lawsuit,0.21058851
how do i maintain a good relationship with my old boss after being promoted ?,no missile evidence .,0.21081224
No people is sitting around a fire at night,how do i maintain a good relationship with my old boss after being promoted ?,0.21106379
queen visits london soldier attack scene,terminal 1 and terminal 2 possess no difference,0.21183154
"the russia of putin has already lost 12 prominent journalists , murdered during the last six years .",the boy is riding a tricycle .,0.2120368
two kids splashing in the water .,how can i build a wall mounted adjustable height desk ?,0.21204653
Low expectations for Iran nuclear talks,A man is watering a tree,0.21215302
"currently i 've got a fairly close to purely digital gtd setup , although this could do with some refinements and tweaks .",four kids holding hands jump into a swimming pool .,0.21228161
There is no woman cutting an onion,ubs settles us mortgage lawsuit,0.21229082
6 killed in u.s. drone strike in nw pakistan,how do i maintain a good relationship with my old boss after being promoted ?,0.21233137
the commerce commission would have been a significant hurdle for such a deal .,A woman is slicing some tomatoes.,0.21245581
two dogs are wrestling on the ground in the snow .,manning sentenced to 35 years for leaking government secrets,0.21266834
second teenager charged with murder,"the users will be the losers , with the employees , and the competitiveness and the european growths will decline .",0.2127927
A man sitting in a back yard playing the guitar.,that darn liberal media never goes after liberals ! ! !,0.2128646
a boy is grinding a skateboard down a concrete wall .,"i 'm no herpetologist , but in my experience , snakes are in the "" you don 't bug me , i won 't bug you "" category .",0.21289238
ukraine signs drilling deal with shell for shale gas,An elderly man is sitting on a bench,0.2129074
a man is slicing a tomato .,the commerce commission would have been a significant hurdle for such a deal .,0.21348944
man with pink shirt sleeping on chair with infant .,iran steps up sensitive nuclear work - iaea,0.21365441
obama urges no new sanctions on iran,if the bulb is contained in a closed path with a switch,0.2136676
two brown horses standing in grassy field .,"man , 19 , quizzed over teen murder",0.2137155
The cat is hungrily drinking milk,"currently i 've got a fairly close to purely digital gtd setup , although this could do with some refinements and tweaks .",0.21377811
why would the addition of more of jesus words be left out of the canon ?,Two people are driving a jeep and a lady is sitting on the top of it,0.21387175
A woman is slicing garlic.,""" why didn 't we hear about the deficit during the bush administration ? """,0.21388024
aid workers freed in afghanistan raid,A cat is playing a piano,0.2140808
a man is climbing a rope .,"currently i 've got a fairly close to purely digital gtd setup , although this could do with some refinements and tweaks .",0.21409939
four ladies in swimsuits play sand volleyball on the beach .,"eventually got him at 8.30. he stayed with "" a friend "" am i asking to much to be told he is not coming home ?",0.2142581
three dogs swim in the water .,java vulnerability due to incomplete patch ( from ),0.21426052
how do i maintain a good relationship with my old boss after being promoted ?,A little boy is watching a family that is hitting a baseball,0.21470493
"blizzard wallops us northeast , closes roads",man with pink shirt sleeping on chair with infant .,0.21472785
algeria hostage death toll rises,make shine,0.21478467
A man pours rice into a pot.,"currently i 've got a fairly close to purely digital gtd setup , although this could do with some refinements and tweaks .",0.2150982
dealbook : dell shares surge after report of possible buyout,i ask again if god does not exist can anything be morally wrong ?,0.21594518
algeria mulls international force for hostages,a shirtless man playing football on a lawn .,0.21679807
the commerce commission would have been a significant hurdle for such a deal .,i have this habit as well .,0.21779889
An empty office chair in a cubicle.,neighboring kyrgyzstan has also experienced raids by taliban-backed islamic militants in recent years .,0.2184093
either half of an archery bow,"google ceo says android important , not critical",0.21936321
three dogs swim in the water .,briton jailed for 10 years for selling fake bomb detectors,0.22016288
There is no woman cutting an onion,how do i maintain a good relationship with my old boss after being promoted ?,0.2210499
"In addition, miR-24 is one of the most abundant miRNAs in cervical cancer cells, and is reportedly up-regulated in solid stomach cancers.",A man sitting in a back yard playing the guitar.,0.22181052
A man is slicing tomatoes,""" why didn 't we hear about the deficit during the bush administration ? """,0.22273631
"currently i 've got a fairly close to purely digital gtd setup , although this could do with some refinements and tweaks .",A man and a woman laughing.,0.22357588
"fear , confusion in algerian hostage crisis",how can i build a wall mounted adjustable height desk ?,0.22443235
this sound like a very bad idea .,tokyo stocks close up 0.13pc,0.22538283
Low expectations for Iran nuclear talks,a dog laying in a pet jacket .,0.22614437
Low expectations for Iran nuclear talks,"A woman is putting on a cloak, which is very large, and concealing an extravagant dress",0.22698073
No people is sitting around a fire at night,an itemized statement of money owed,0.22781105
terminal 1 and terminal 2 possess no difference,a man is riding a white horse .,0.2286412
A man is doing a magic trick,"the russia of putin has already lost 12 prominent journalists , murdered during the last six years .",0.22950289
Low expectations for Iran nuclear talks,watery rot on produce caused by fungus,0.23035944
second teenager charged with murder,thus the need for health care insurance reform ... the,0.23121417
three dogs swim in the water .,former zambian president arrested,0.23205873
what is driving our growth in government spending # facts,"eventually got him at 8.30. he stayed with "" a friend "" am i asking to much to be told he is not coming home ?",0.2328814
either half of an archery bow,how do i maintain a good relationship with my old boss after being promoted ?,0.2337295
There is no butter being added to the stand mixer,"the authorities thaï the bloquèrent the passport control , and in the end , it out hong kong .",0.23459333
6 killed in u.s. drone strike in nw pakistan,"but as the european union itself , this will be built and this will happen .",0.23544048
watery rot on produce caused by fungus,obama urges no new sanctions on iran,0.23627867
how do i maintain a good relationship with my old boss after being promoted ?,Some fish are swimming quickly,0.23712936
A man is peeling an onion.,myanmar was formerly called burma .,0.2379646
Low expectations for Iran nuclear talks,a brown dog laying on a blue cover .,0.23878488
"eventually got him at 8.30. he stayed with "" a friend "" am i asking to much to be told he is not coming home ?",A woman is slicing some tomatoes.,0.23967189
"We are about to witness the third Israeli election in the space of one year.

The elections for the Knesset, Israel’s parliament, which are coming in March, are being held after the failure of anyone to either score an overall majority or to forge a coalition government.

Israeli prime minister, Benjamin Netanyahu, is holding on for now. His far-right coalition won the most seats in the last election in September, but it was not enough to form a government with a majority.

It is possible that the Blue and White party could win the next election – they actually came one seat ahead of Netanyahu’s party, Likud, in the last election.

READ: US opposes Israel annexation of West Bank before peace plan revealed

But even if they did, so what? For the Palestinians, all Zionist parties in Israel mean the same thing: continuation of the daily, grinding, violent reality of Israeli racism and occupation.

The West Bank is under the boot of Israel’s military dictatorship. Palestinians who dare challenge it are indiscriminately beaten, tortured, abused, have their homes demolished or are even murdered by the Israeli military and settlers.

The Gaza Strip is under constant siege, and the brave unarmed Palestinian demonstrators trying to break out of it since 2018 have been shot down dead by brutal Israeli snipers.

The Palestinians inside ‘Israel’ – the Palestinian territories occupied by Zionist forces, starting in 1947 – are not full citizens of the state. By law and by practice, they have far fewer rights than Jewish citizens of Israel. Israeli courts have consistently ruled for decades that there is no such nationality as ‘Israeli’ and that the state belongs to Jews alone.

Finally, the Palestinian refugees outside Palestine still languish for long decades inside their camps – being denied their most fundamental right to return to the homes they were expelled from.

READ: Netanyahu vows to annex all settlements ‘without exception’

But this totally unjust situation is not enough for Israel – both the state and society wants more.

As I wrote at the time, in the last election, at least 89 per cent of Israelis voted for parties whose policy it was to continue the occupation of the West Bank – military dictatorship with no rights, remember – indefinitely.

And now, with the third election looming, Israel’s two leading parties, Likud and Blue and White, are both ramping up their threats to formally annex large parts of the West Bank.

The West Bank and the Gaza Strip together consist of only 22 per cent of historic Palestine, as it was at the time that the British occupation ended in 1948.

So, 78 per cent is not enough for Israel still. They want it all.

While it seems unlikely for the time being, that they could get away with a mass expulsion, ethnic cleansing-type-event as they did in 1948, victory for Zionism looks like this: maximum land, minimum Arabs.

So, in working towards this end, Israel has been slowly, in the decades since it occupied the remaining 22 per cent, absorbing the entire West Bank through the creation of “facts on the ground”.

#IsraElex19: Israeli Elections 2019 Everything you need to know >>

These “facts” are a slow-motion ethnic cleansing. Palestinian homes are declared to have been built “without permits” (impossible in many areas, since Israel almost always denies such permits to Palestinians – even while granting them to Jews) and are thus destroyed. Industrial-scale colonies for Jews are then built on the ruins.

Annexation will be the formal, post-facto legitimisation of such blatant criminality in Israeli law – and it looks set to be supported by the US.

President Donald Trump has already done this in the case of the Golan Heights. This is a Syrian territory, illegally and violently invaded and occupied by Israel in 1967. Yet Trump (urged on by his number one campaign funder, Sheldon Adelson, a casino billionaire and important US Israel lobbyist), decided to formally recognise the “legality” of this outright criminality – just as he did in moving the US embassy to Jerusalem.

So there really was no doubt that the most pro-Israel US president would ever give the green light to any annexation move in the West Bank, even before the latest second-hand reports from anonymous Israeli sources emerged about the latest version of Trump’s ‘deal of the century’.

In the forthcoming election, both main Israeli parties are attempting to outdo one another on how much Palestinian land they can steal, clear out of its Palestinians, and then annex for the purposes of building Israeli colonies.

Last election, Netanyahu promised to annex the Jordan Valley, and Blue and White’s Benny Gantz (a former general), indicated he’d agree to the same.

Now this election, Netanyahu is talking about annexing as much as 40 per cent of the West Bank, while Gantz is now promising to steal the entire Jordan Valley (the part of the West Bank that borders Jordan).

Annexation, then, is coming. Will this finally spell the long-forecast collapse of Israel’s collaborationist entity, the Palestinian Authority? Time will tell.

One thing is for sure: this situation will not hold indefinitely. Five million Palestinians are being denied even their most basic human rights – systematically, by design of Israel’s racist laws. This cannot be indefinitely sustained.

The views expressed in this article belong to the author and do not necessarily reflect the editorial policy of Middle East Monitor.",bulb a is in a closed circuit with the battery without the y switch .,0.24053746
The chef is carefully drying the oil from the pan,no missile evidence .,0.24136938
britain set to join high-speed mobile party,i ask again if god does not exist can anything be morally wrong ?,0.24219269
A woman is receiving volleyballs,how do i maintain a good relationship with my old boss after being promoted ?,0.24307124
A grey silky dog is sleeping in the grass and a brown dog is looking on,bomb blast kills 10 in southwest pakistan,0.2439048
executive recruiters say that finding a seasoned chief merchandising officer will perhaps be the trickiest of all hires because there is such a dearth of good ones .,A man sitting in a back yard playing the guitar.,0.24474701
The man in a cowboy hat is walking through a market and is putting a hand in his pocket,i like watching kids play .,0.24560976
A kid is smiling at the camera and swimming underwater,the judicial order accused raghad of funding terrorism .,0.2464594
executive recruiters say that finding a seasoned chief merchandising officer will perhaps be the trickiest of all hires because there is such a dearth of good ones .,A man is hugging and kissing a woman.,0.24730352
there is no gap between terminal 4 and the positive terminal,this sound like a very bad idea .,0.24813446
china fm hosts senior asean officials,a boy pushes a wagon with two pumpkins .,0.2489928
they didn 't even have a train station ...,obama urges no new sanctions on iran,0.24984762
seperate paths connected to the battery,no it does not affect your ratings .,0.2506946
"i don 't know if i should say this , but if your job is making you anxious .",A boy is spanking a man with a toy weapon,0.2515322
a large brown dog is crouching in a grassy field .,side note first : i don 't think that physicists always agree on their theories and predictions .,0.2523864
"the russia of putin has already lost 12 prominent journalists , murdered during the last six years .",A man and woman are dancing in rain.,0.2532173
wall street was also waiting for aluminum maker alcoa inc . ( nyse : pep - news - people ) to report earnings after the close .,Two men are fist fighting in a ring,0.25406998
"the russia of putin has already lost 12 prominent journalists , murdered during the last six years .",a girl is playing a guitar .,0.25491664
this sound like a very bad idea .,Five people are standing in the grass with no dogs,0.25577095
officials with torch and jetblue did not respond to repeated phone calls from the mercury news seeking comment .,An elderly man is sitting on a bench,0.2566127
a young pitcher is throwing the baseball .,a siemens spokesman in germany refrained from commenting on the political aspect of the sale of the plutonium-processing facility .,0.2574612
"All known GEFs reconfigure the nucleotide-binding pocket, often opening it by rearranging the switch regions.",a man is riding a white horse .,0.25831294
man with pink shirt sleeping on chair with infant .,"Yes, although they can be a bit sour.",0.25916982
u.s. stocks fell in early morning trade on wednesday as a wave of profit warnings drained some of the optimism that has driven a rally over the past three months .,what type of faucet is this ?,0.26000813
A man is cutting apple by his hand.,"wal-mart , kohl 's corp. , family dollar stores inc . , and big lots inc. were among the merchants posting may sales that fell below wall street 's modest expectations .",0.26085544
a black and white cat sleeps on a purple blanket .,ubs settles us mortgage lawsuit,0.26170063
religious extremism continues in pakistan despite the banning of militant groups by the pakistani government .,a man is riding a white horse .,0.26254112
i don 't think it makes much difference .,deadly blast rocks coal mine in east ukraine,0.2633937
"eventually got him at 8.30. he stayed with "" a friend "" am i asking to much to be told he is not coming home ?",i have this habit as well .,0.26424086
"organize anew , as after a setback .",a child is riding a horse .,0.26508588
"tragic . my thoughts and prayers go out to all ... "" at least 220 killed in brazil nightclub fire """,ann romney has never had to get out and be a part of the workforce .,0.26593587
There is no man mixing vegetables in a pot,british warship sets sail for falklands,0.2667851
official says kenyan forces caused mall collapse,a man is riding a white horse .,0.26762903
terminal 1 and terminal 2 possess no difference,The man is playing a guitar,0.26847708
amendment no 7 proposes certain changes in the references to paragraphs .,A surfer is riding the wave,0.2693224
a dog sitting on a yellow chair next to a green dumpster .,neighboring kyrgyzstan has also experienced raids by taliban-backed islamic militants in recent years .,0.2701704
i have this habit as well .,pakistani plane crashes with 130 people on board,0.2710182
the questions oprah should 've asked lance amstrong,A cat is playing a piano,0.27186513
The man is playing a guitar,nytimes : great obit on dear abby .,0.27271247
casey anthony files for bankruptcy,iran steps up sensitive nuclear work - iaea,0.27356008
A woman is seasoning a ham,"so , i guess that 's it .",0.27440572
what if i don 't have enough work sample for an interview ?,The young woman is flirting with the young boy.,0.2752552
The man is riding a horse by a creek,"the authorities thaï the bloquèrent the passport control , and in the end , it out hong kong .",0.2760985
the vector space model has several disadvantages .,Three men and a woman are standing still for a picture,0.2769456
a woman is cutting some herbs .,"so , i guess that 's it .",0.277793
he was the first speaker of the house in history to be fined .,a 20-something ? s web site for women over 40,0.2786399
religious extremism continues in pakistan despite the banning of militant groups by the pakistani government .,A man and woman are dancing in rain.,0.27948844
"""The clear message is it should not be used to prevent cardiovascular disease,"" Manson said.",A young swimmer is standing in a bathing suit and waiting for the next race,0.28033632
"the users are the losers , employees , and european competitiveness and growth régresseront .","a girl swings her long , wet hair in a lake .",0.28118417
A woman is cleaning a shrimp,"the russia of putin has already lost 12 prominent journalists , murdered during the last six years .",0.28202912
There is no man spitting,study shows college degree ? s value during economic downturn,0.2828765
this sound like a very bad idea .,two white standard poodles play with a toy in the snow,0.28372502
"three children playing with hay outdoors , throwing some at camera lens .",the united states and other nato members have refused ratify the amended treaty until russia completely withdraws from moldova and georgia .,0.28456983
i have this habit as well .,"men tried to behead soldier on london street , court hears",0.28541857
"iraqi police opened fire in downtown baghdad wednesday after demonstrators demanding jobs stormed a police station and threw stones at officers , police said .",no it does not affect your ratings .,0.2862652
he 's not wealthy because he 's successful .,police raise death toll in bus accident to 8,0.28711274
bomb attacks kill 20 in baghdad 's christian areas,the boy is riding a tricycle .,0.28795987
"i would like to remind you that one of our allies , there are strong this tax .",this sound like a very bad idea .,0.28880566
amendment no 7 proposes certain changes in the references to paragraphs .,There is no boy playing a guitar,0.28965345
briton jailed for 10 years for selling fake bomb detectors,a dog splashes in the murky water .,0.2905004
