sentence1,sentence2,similarity
terminal 1 and terminal 2 possess no difference,former zambian president arrested,0.29134756
faa continues ban on us flights to tel aviv,"the "" more posh "" words are usually latin ( occasionally greek ) in origin .",0.29219556
second teenager charged with murder,It has a margin of error of plus or minus 4 percentage points.,0.2930427
the man is shooting an automatic rifle .,"storm lashes florida , delaying republican convention",0.29388756
"ok , that 's a good point .",Three men and a woman are standing still for a picture,0.2947357
casey anthony files for bankruptcy,"Want to enjoy 'Zen' reading - with no ads and just the article? Subscribe today

Back to page",0.2955823
a man is slicing a tomato .,two kids splashing in the water .,0.29643005
russia ratified the amended version of the treaty .,obama takes ' selfie ' at mandela 's funeral service,0.2972772
there is no gap between terminal 4 and the positive terminal,The man is mixing whipping cream.,0.29812407
adhere to stereotypes perpetrate a negative / unform view of the lgbt community .,Ten people riding ATVs.,0.29897177
because the positive batter terminal and terminal 6 were connected .,"a girl swings her long , wet hair in a lake .",0.29981858
amendment no 7 proposes certain changes in the references to paragraphs .,Some fish are swimming quickly,0.3006665
a young woman leans over her plate at a meal .,spacex dragon docks with international space station,0.30151254
A man is wearing a colorful shirt and a lot of jewelry,i don 't think it makes much difference .,0.3023599
comcast class a shares were up 8 cents at $ 30.50 in morning trading on the nasdaq stock market .,remove facial hair by tying a fine string around it and pulling at the string .,0.30320698
the questions oprah should 've asked lance amstrong,there is no gap so there is no difference in voltage,0.30405167
britain set to join high-speed mobile party,A man playing the violin in the rain.,0.30490083
A young man on a bmx bicycle is jumping off a masonry pyramid,u.s. stocks fell in early morning trade on wednesday as a wave of profit warnings drained some of the optimism that has driven a rally over the past three months .,0.30574733
"it was our day , how we wanted and it was wonderful .",There is no young Asian woman with pink gloves standing in the snow,0.3065952
"us , nato raise doubts russia pulled back from ukraine border",this frame contains nouns denoting aggregates of individuals. the aggregates may be described by an aggregateproperty .,0.3074419
the vector space model has several disadvantages .,A football player in a purple jersey is breathlessly running with the ball for a touchdown,0.30828947
former zambian president arrested,a black dog jumps through the water .,0.30913723
queen visits london soldier attack scene,"when energy is born waves , now the big moves .",0.30998302
north korea sendin them threats again,a large sheep standing on a hill .,0.31083053
An empty office chair in a cubicle.,A man is hugging and kissing a woman.,0.31167787
executive recruiters say that finding a seasoned chief merchandising officer will perhaps be the trickiest of all hires because there is such a dearth of good ones .,girl stands in subway waiting on something .,0.31252456
"the driver of the last to try to avoid it through a sudden move , but he fell short by his right side .",us gov 't officially designates haqqani network as terrorists,0.31337267
The elderly lady is waiting on the sidewalk,"gun violence is absolute a # publichealth issue . good work , on your gun reform for a generation # itsastart",0.31421947
often we are proud of representing europe 's citizens .,pakistani plane crashes with 130 people on board,0.31506616
"A man with equipment used for climbing is under a vertical, white rock",myanmar was formerly called burma .,0.31591266
Someone is falling off the horse,"gun violence is absolute a # publichealth issue . good work , on your gun reform for a generation # itsastart",0.31676066
"A woman is putting on a cloak, which is very large, and concealing an extravagant dress","internet activist # aaronswartz , creator of # rss , is dead at 26- suicide . was the pressure of pending lawsuits too much ?",0.31760746
what is driving our growth in government spending # facts,"the rev. christopher j. coyne , spokesman for the archdiocese , wouldn 't comment friday .",0.31845427
algeria hostage death toll rises,the cognitive processes and capacity to remember .,0.31930137
funeral of ian paisley to take place in belfast,a dog shaking off water .,0.32014883
a young woman leans over her plate at a meal .,Syria army continues mop-up operations near Damascus,0.32099587
cold wave cut murders in new york city significantly,A man in a black dress is pulling a cart and is standing in front of two men who are seated on a park bench,0.32184297
only two bombs found in boston marathon attack,the act of changing one thing or position for another .,0.32268983
A woman is chopping an onion,cuban officials said that last year none of about two dozen nominated cuban musicians received u.s. visas in time to attend the latin grammys .,0.3235372
A person on a bike is riding on one wheel only,"but as the european union itself , this will be built and this will happen .",0.324384
a jockey riding a horse in a pen .,"abuse of a father- "" which led to suicide """,0.3252313
"the a920 comes with a printer , scanner , and copier for $ 89 .",animals are playing in water .,0.32607847
u.s. stocks fell in early morning trade on wednesday as a wave of profit warnings drained some of the optimism that has driven a rally over the past three months .,myanmar was formerly called burma .,0.32692537
become wrinkled or crumpled or creased .,saudi arabia defends maid 's execution,0.3277725
Five adults are sitting on stone steps,a cat plays with a small bottle .,0.32862
"storm lashes florida , delaying republican convention",a girl wearing green twists something in her hands .,0.32946736
19 killed in tunis museum attack,lugar and nunn are senators .,0.33031416
issue bonds on something,Five people are standing in the grass with no dogs,0.33116102
A small child is drinking water from a cup.,frist proposed a process in which it would take gradually fewer votes to overcome filibusters preventing final votes on judicial confirmations .,0.3320086
"bangladesh muslims torch buddhist shrines , police say","and what do you know , receipts stayed about the same .",0.33285525
have or be covered with bristles,several people are sitting around a fire at night .,0.33370256
"the value will total about $ 124 million , including convertible securities , according to corel .",gunmen kill female politician in pakistan,0.3345493
"Three young men run, jump, and kick off of a Coke machine.",It has a margin of error of plus or minus 4 percentage points.,0.33539623
"the "" more posh "" words are usually latin ( occasionally greek ) in origin .",south korea regrets north 's refusal of talks,0.33624363
"bangladesh muslims torch buddhist shrines , police say",A man is putting some food in a container,0.33709127
a dog splashes in the murky water .,japan switches off last nuclear power plant this weekend,0.3379374
syrian forces overrun rebel stronghold,""" they 've been in the stores for over six weeks , "" says carney .",0.33878487
because there was no gap from the positive terminal of the battery,chinese shares close lower on wednesday,0.33963192
A person is taking a cat down from the ceiling,what is driving our growth in government spending # facts,0.3404793
A person is cutting an onion into pieces,the united states and other nato members have refused ratify the amended treaty until russia completely withdraws from moldova and georgia .,0.34132618
iran steps up sensitive nuclear work - iaea,"this sweet love story made me weepy . no , really :",0.34217358
"if you want to learn photography , almost any camera will do to start with .","a girl swings her long , wet hair in a lake .",0.34302032
a black faced sheep .,the nuclear nonproliferation treaty is reviewed every 5 years .,0.3438664
"then , that there was nothing economically that we could do about the greenhouse gases .",a woman is slicing some vegetables .,0.34471416
A person is playing basketball on a team.,french parliament backs reform of law on prostitution,0.34556162
china is investing in # education - # highered # edpolicy,second teenager charged with murder,0.34640878
have or be covered with bristles,The boy is riding a bike on the top of a fence made of metal,0.3472556
suicide blast kills 1 in afghan capital,The man is playing a guitar,0.3481028
Some boys are kneeling next to each other in front of a ball,because the battery has its own chemical reacion between the positive and negative tterminals it contains,0.34895003
a man catches a fish .,'Fast &amp; Furious' star Paul Walker dies in car crash,0.3497971
A brown and white dog is running across a brown field.,I think this is one of those things where you are just out of luck.,0.35064363
that 's how the driver tests the validity of the registered voucher .,a young pitcher is throwing the baseball .,0.35149097
Co-transfection of miRVec-miR-204 and the Renilla-3′ UTR plasmid was in HEK293T cells with TransIT-LT1 Transfection Reagent (Mirus),there is no test that can tell you if it is sealed or not .,0.35233846
moffitt said the results need to be replicated in another study before testing of individuals for presence of the long or short versions of the gene will be pursued .,A woman drives a golf cart.,0.35318494
the girl wearing a blue shirt is running through a science center .,a man is spreading butter on a tortilla .,0.35403204
"A dog, which is large and gray, is carrying a ball in its mouth and running across the grass",do you notice the nonsensical things you are saying ?,0.35487947
Bread is being sliced by the man,it is impossible to answer this question without a form check .,0.35572654
become wrinkled or crumpled or creased .,A man and woman are dancing in rain.,0.35657376
us senate votes to advance iran nuclear review bill,A boy and a girl are playing on the outdoor gym,0.35742122
"the users are the losers , employees , and european competitiveness and growth régresseront .",russia ratified the amended version of the treaty .,0.35826802
"also in mosul , rebel gunmen on friday assassinated a sunni muslim tribal leader who backed the coalition .",A person is strongly whisking eggs in a bowl,0.3591147
only two bombs found in boston marathon attack,A woman is seasoning a ham,0.35996196
cycling : armstrong apologizes to staff,homs mortar fire kills 105,0.3608091
faa continues ban on us flights to tel aviv,no it does not affect your ratings .,0.36165607
there is no gap so there is no difference in voltage,one killed in clashes at muslim brotherhood cairo offices,0.3625037
israeli forces detain 5 palestinians in west bank,"the users are the losers , employees , and european competitiveness and growth régresseront .",0.36335033
mourners clash with police in tunisia,A woman drives a golf cart.,0.3641975
A man is speaking,it is necessary to find other means .,0.36504456
a busy beach has people scattered on it watching the sky .,he 's not wealthy because he 's successful .,0.36589175
"news, local-news,

Since the age of 10 Sam Willis knew he wanted to be a paramedic but he never imagined he would become a successful lecturer, author, editor teaching paramedicine in two countries. The English born and raised senior lecturer has now been in Port Macquarie over a year and said he loves what he does. ""When I was about 10 I witnessed a car crash and watching the paramedics work I knew that was what I wanted to do when I grew up,"" Sam said. ""The paramedics I saw that day instinctively knew what to do and I thought they had all the answers to help the people who were hurt and I knew then I wanted to do the same thing when I got older. ""It hasn't always been an easy path to get where I wanted to go but I believe with passion and determination then you can get there. ""When I started as a paramedic in England I never thought I would go on to teach at universities in two countries or be an author but that is my life."" Mr Willis is a senior lecturer in paramedicine at Charles Sturt University based in Port macquarie, Mr Willis has a masters degree and is currently working towards a PhD in paramedicine, and said growing up his life wasn't easy but with a goal of where he wanted to end up his passion and drive got him there. ""I didn't get the marks at school to go and study what I wanted to right away so I had to go to college before going to university,"" he said. ""It wasn't easy and I had to make a lot of sacrifices but knowing what I wanted made it worth it. In the beginning I worked as an ambulance dispatcher and i didn't get into paramedicine the first time so it was challenging. ""I did question what I wanted and if it really was what I wanted but deep down I knew it was."" As a lecturer Mr Willis said he does sympathise with students who are struggling and prides himself on trying to help them. ""When I was studying the course was challenging which did make it hard at times but I am a big believer in even if something is hard you should go for it."" Mr Willis is the co-author and a contributor to a second edition of Fundamentals of Paramedic Practice, an accessible and comprehensive introduction to paramedic science and pre-hospital care, providing expert and up-to-date guidance on the essential theories and real-world practice of this dynamic area of emergency medicine. ""The book came about because there aren't a lot of new books coming about about paramedicine and I wanted to change that. ""The book has a large number of fantastic contributors who have ensured the book is relevant and up to date."" The book is being launch at Charles Sturt University in Port Macquarie on March 10. Please register to attend here While you're with us, you can now receive updates straight to your inbox from the Port Macquarie News. To make sure you're up to date with all the news, SIGN UP HERE. If you value local journalism, continue to support us and consider taking out a subscription. CLICK HERE for a 30-day free trial.

https://nnimgt-a.akamaihd.net/transform/v1/crop/frm/laura.telford/66d4e684-21ad-459f-aff5-13e994c3043d.jpg/r0_108_4032_2386_w1200_h678_fmax.jpg",Five people are standing in the grass with no dogs,0.36673906
iran arrests several spies near nuclear plant,cause to appear in a new form .,0.36758566
"weak protection laws for domestic workers : saudi execution : brutal , inhuman and illegal ? - cnn # p2 # p21 # tcot # ccot",The players is maneuvering for the ball,0.36843312
"nato says four troops killed in "" insider "" attack in afghan south","and what do you know , receipts stayed about the same .",0.36928037
cater to popular taste to make popular and present to the general public ; bring into general or common use .,kids are dancing .,0.3701272
"according to alemanno , indeed , "" we need a sketch of strategic reference , neither firm nor immobile , to allow our city to improve , which is absolutely necessary , while thinking about its future in a spirit of unity , "" .",libyan militia takes control of tripoli airport,0.37097436
a black and white cat sleeps on a purple blanket .,a woman is slicing some vegetables .,0.3718211
a man in a red striped soccer shirt heads a ball .,"i 'm terrified , and dh doesn 't talk about it much but he 's nervous too .",0.37266868
man with pink shirt sleeping on chair with infant .,a woman cuts off a small piece of lemon rind .,0.37351587
make shine,a woman is peeling an orange .,0.37436253
ecuador yet to decide on assange 's asylum,A person is peeling a banana,0.37520963
why would the addition of more of jesus words be left out of the canon ?,'Fast &amp; Furious' star Paul Walker dies in car crash,0.3760569
suicide blast kills 1 in afghan capital,Three enemies are making faces for the camera,0.37690413
dozens injured as boeing 777 jet crash lands at san francisco airport,holder filed a three-page letter .,0.37775087
y is not needed for bulb a to light,"give an incentive for action , provoke or stir up , urge on , or cause to act .",0.37859815
north korea sendin them threats again,"i 'm no herpetologist , but in my experience , snakes are in the "" you don 't bug me , i won 't bug you "" category .",0.37944525
A few women are holding each other and dancing together,"Yes, although they can be a bit sour.",0.38029242
some syria violence qualifies as civil war -red cross,obama urges no new sanctions on iran,0.38113934
terminal 6 is directly connected to the positive terminal .,Syria army continues mop-up operations near Damascus,0.3819864
queen visits london soldier attack scene,french parliament backs reform of law on prostitution,0.3828336
A dog is running on the sea shore,egypt : police clash with pro-morsi protesters,0.3836807
a state of extreme poverty .,Sunderland 2-2 Bolton: Davies in at the double,0.3845278
what the pope 's butler saw – aide arrested over vatican leaks,no missile evidence .,0.3853749
record a charge in a police register ;,a conceptual formulation ; a way of conceiving something .,0.38622203
a black faced sheep .,permalink to two killed in germany train accident,0.38706934
a bicycle is parked outside a bookstore .,( cause to ) survive,0.38791615
protesters had been calling for an end to the country 's hard-line establishment and for supreme leader khamenei 's death .,a group of people in front of a red fire truck .,0.38876325
No people is sitting around a fire at night,Two men are playing a game of Scrabble together.,0.38961044
i 'd start by reading david allen 's book : getting things done .,indonesia police shoot dead suspected militants in bali,0.39045703
AbbVie Sours on $55B Shire Deal After Tax Changes,someone who cleans soot from chimneys .,0.39130443
A blonds girl is surfing,A little boy is watching a family that is hitting a baseball,0.39215136
algeria hostage crisis ends ; death toll unclear,how can i repair a towel bar with one end ripped out of the wall ?,0.39299875
u.n. concerned at possible syria chemical weapons,i 'd say it depends what conditions you have .,0.39384577
"yes , dew ( wetness in the environment ) factor can change the direction of a match .",how can i build a wall mounted adjustable height desk ?,0.39469302
because the positive batter terminal and terminal 6 were connected .,a global crossing representative had no immediate comment .,0.39553988
ukraine signs drilling deal with shell for shale gas,The chef is carefully drying the oil from the pan,0.39638686
it assumes that methane growth rate accelerates by . % / yr .,a dog shaking off water .,0.39723432
a is on its on path b and c share a path,force to go away by blinking one eye .,0.39808148
jake with the assist .,There is no boy playing a guitar,0.39892817
"a white tour bus with red , orange and yellow stripes .",that does not release however the rich countries of their obligation to help .,0.3997758
- video shows usda official saying she didn 't give ' full force ' of help to white farmer date says 7 / 20 .,"when energy is born waves , now the big moves .",0.40062255
a small black dog is in the grass .,fire destroys tibetan town in china,0.40146977
japan surrendered unconditionally .,"the americas market will decline 2.1 percent to $ 30.6 billion in 2003 , and then grow 15.7 percent to $ 35.4 billion in 2004 .",0.4023166
i 'd start by reading david allen 's book : getting things done .,how can i build a wall mounted adjustable height desk ?,0.40316388
twitter says images blocked in venezuela,really ? man says he 's ' certain ' where hoffa is buried,0.40401092
the learning network blog : student opinion | does facebook ever make you feel bad ?,issue bonds on something,0.40485767
The man is not climbing up a rope,the woman is poking holes in the potato .,0.40570486
"for kathy nicolo ( jennifer connelly ) , the house means stability and family .",the gap separates the positive battery terminal from terminal 1,0.40655214
"mohanty stated that the upgrade will be done soon as it has almost been finalised by the defense research and development organisation , hindustan aeronautics limited and the indian air force .",A ball is being caught by a dog in mid air,0.40739924
There is no rhino grazing in a field,A bowl of soup is being cleaned by a chef,0.4082464
a black dog retrieves in the snow .,"act in accordance with someone 's rules , commands , or wishes .",0.4090931
four kids holding hands jump into a swimming pool .,The dog is not playing with a plastic container,0.40994042
A young man is talking to a leaf,obama has said that it was the future .,0.4107877
britain set to join high-speed mobile party,egypt : child killed in cairo clashes after pro-morsi protest,0.4116348
The person is walking,Syria army continues mop-up operations near Damascus,0.4124815
group of horses grazing in grassy field .,two men are setting up some electronic equpitment,0.4133288
do better in a competition ; win,"the success of the book is in itself a sign of ‘ malaise . """,0.41417605
bomb attacks kill 20 in baghdad 's christian areas,""" let 's show we won 't let them off , "" said marc blondel , leader of the force ouvriere union .",0.41502315
A man is wearing a colorful shirt and a lot of jewelry,A dog in a bucket is biting a tree which is probably a pine,0.4158704
police : four killed in german hostage taking incident,when printed on a lens the f-stop is usually expressed as a ratio with a colon ( i.e .,0.41671804
A young man is talking to a leaf,the state of having one 's weight supported,0.41756415
A person is folding a sheet,a dog swims after a tennis ball .,0.41841137
I would personally beware of the Motley Fool.,israeli doctors could be tried abroad for force-feeding palestinian prisoners,0.41925853
or heels of transgressing or clothes .,A man and woman are dancing in rain.,0.42010564
red double decker bus driving through the streets .,There is no girl jumping into the car,0.4209528
a girl holding a picture of Michael Jackson smiling,"three children playing with hay outdoors , throwing some at camera lens .",0.42180026
the blub is not contained in the same closed path as the battery,A man is breaking boards made of wood with his hand,0.42264703
lean in sisters .... nytimes : she ’ s ( rarely ) the boss,the cause of this exclusion is that the stock exchange of warsaw is owned by the state .,0.423494
he was the first speaker of the house in history to be fined .,bombings kill 9 people in iraqi capital,0.42434108
op-ed contributor : how to get high-speed internet to all americans,the key thing you need to do in this meeting is listen .,0.42518824
"claudette , the first hurricane of the atlantic storm season , hit the mid-texas coast july 15 , classified as a category 1 hurricane with maximum sustained winds of 85 mph .",A young man is talking to a leaf,0.4260348
a horse rider is riding a white horse .,The man is eating potato slices,0.4268823
it 's a good question .,often we are proud of representing europe 's citizens .,0.4277294
the man is shooting an automatic rifle .,man with pink shirt sleeping on chair with infant .,0.428577
"zimmerman pulled over in texas for speeding , given warning",A woman is receiving volleyballs,0.42942333
second teenager charged with murder,"Another positive case of coronavirus (COVID-19) has been reported in Mason County. A man in his 70s became the 18th County resident to test positive. Mason County Public Health was notified of the latest positive test on Wednesday, April 9, 2020. Mason County Public Health is conducting contact interviews at this time. The patient is currently isolating at home.

Case information for the 18 positive cases is as follows:

Only one patient has been hospitalized outside Mason County. The remaining patients are isolating at home.

So far, 502 people have been tested in Mason County.

Due to Mason County being a small community, location data of positive cases will not be released to reduce the possibility of patient identification and to protect personal health information. Identified positive cases are located throughout Mason County. To avoid exposure, continue to follow the guidance of washing hands frequently, stay home, unless essential to work and limit travel to only medical appointments, medication pick up, and once every two-week grocery shopping needs. This will help limit your exposure possibilities. Mason County Public Health is asking that the public do their part to help reduce the spread of COVID-19.",0.43027103
the hard upper part of the human nose,south korea confirms that north korea has conducted controversial third nuclear test,0.431118
A podium is where a man is speaking,op-ed contributor : how to get high-speed internet to all americans,0.43196464
"nytimes : d. brainerd holmes , a leader in space race , dies at 91",a dog shaking off water .,0.4328121
a busy beach has people scattered on it watching the sky .,A woman is wearing a long black coat and a brown hat and is walking past a park with a lot of blooming trees,0.4336598
"in fact , watching fox will tell you the exact opposite of what you are claiming .",sheik doon salad ilmi stated that civilian casualties resulting from overnight mortar and rocket attacks are admitted to the hospital nearly every day .,0.43450582
"All known GEFs reconfigure the nucleotide-binding pocket, often opening it by rearranging the switch regions.",a bicycle is parked outside a bookstore .,0.4353537
The man is playing a guitar,The little dog is grabbing the bedroom slipper with its mouth funnily,0.4362012
ecuador yet to decide on assange 's asylum,6 killed in u.s. drone strike in nw pakistan,0.43704784
jake with the assist .,The man is doing a wheelie with a motorcycle on ground which is mostly barren,0.43789512
