sentence1,sentence2,similarity
"As an angry Donald Trump tweeted at a record-setting pace, US senators involved in his impeachment trial struggled to stay awake and stay quiet during a marathon session as the Democrats made their case to remove the US president from office and try establish the rules for the trail.

A number of relatively arcane laws mean Senators are meant to stay quiet and are not allowed to speak to each other during proceedings.

Technically, the only drink allowed to be consumed on the floor of the chamber is water, but allowances have been made for milk, sending social media into overdrive as to why one senator was reportedly seen drinking milk during the trial.

Can anyone explain to me why senators during the impeachment are only allowed to drink water or milk? This may be one of the strangest things I've ever seen... — Doug Black Jr (@dougblackjr) January 22, 2020

But behind closed doors - where the media is not allowed - senators have been flouting the quaint guidelines of the chamber that typically prizes decorum.

Gum-chewing, snacking, yawning and alleged napping could be seen throughout the cramped chamber, the Associated Press reported.

Senators were especially restless Wednesday, local time, as lawmakers convened less than 12 hours after the marathon session that stretched to nearly 2 am.

A number of senators were seen resting their eyes, dozing and appearing to take brief naps, according to CNN and the Associated Press.

A cartoonist for the New York Times observing the proceedings even managed to sketch Republican senator James Risch dozing off.

Others, meanwhile, were seen passing notes and doing crosswords while senators were speaking.

NYT has a sketch artist covering impeachment, catching moments like Sen. Risch sleeping https://t.co/kXf9Voi0Og pic.twitter.com/fH5fee7In4 — Michael Calderone (@mlcalderone) January 22, 2020

Chief Justice John Roberts, who is presiding over the affair, admonished senators as tensions rose on Wednesday, local time, reminding those gathered it is the “world’s greatest deliberative body,” functioning, for now, as a court of impeachment.

Story continues

It has a tradition of civility — and for rare impeachment trials, specific rules: No coffee or snacking on the floor. No pacing, note-passing, working on other matters or chit-chat. It’s all designed to focus the senator-jurors on the issues at hand. So napping is not, in theory, part of the plan.

A number of senators also left the chamber during the opening days, some to conduct lengthy TV interviews, leaving a number of seats empty, AP reported.

9- As the night wore on, senators were restless. Some walked to the back of the chamber and stretched. Sen. Gillibrand took off her heels, sighed then wrapped herself in a red blanket at her desk. Both her &McConnell started to doze off before jolting themselves back awake — Christal Hayes (@Journo_Christal) January 22, 2020

‘Its not fantasy football’

In the opening two days of proceedings, the two sides have been wrangling over rules for the trial and who will be allowed to testify.

Republicans shot down, one by one, Democratic efforts to get Trump aides to testify, including former national security adviser John Bolton, Secretary of State Mike Pompeo, and acting chief of staff Mick Mulvaney.

Bolton has referred to the White House's alleged political pressure on Ukraine as a ""drug deal"", according to previous witness testimony in the House of Representatives.

Trump returns to the White House Wednesday, local time, after attending Davos. Source: AAP

Trump is charged with abusing his power by trying to pressure Ukraine to investigate political rival and leading Democratic presidential candidate, Joe Biden.

The Republican-controlled US Senate has voted on party lines to approve the rules for President Donald Trump's impeachment trial, rejecting Democratic efforts to obtain evidence and ensure witnesses are heard.

Trump’s Republican allies in the Senate say the son of Joe Biden, Hunter, should testify after Trump accused the former vice president of pursuing his son's interests by pressuring Ukraine to oust a prosecutor that had scrutinised a Ukrainian gas company. No evidence of wrongdoing by Biden has emerged.

Top Democrat Chuck Schumer hosed down the idea of a witness trade, telling reporters during a break in the trial “that trade is not on the table”.

“This isn't like some fantasy football trade,” he said. “Trials aren't trades for witnesses.”

Senator Adam Schiff and feloow Democrats talk to reporters before the second day of the Senate impeachment trial. Source: Getty

Democrats will continue their arguments through Friday under rules approved by the Senate.

Trump's lawyers will then have up to three days to rebut the Democrats' case, likely starting from Saturday.

The lead Democratic prosecutor and California congressman Adam Schiff, urged Republicans to vote to remove Mr Trump from office to ""protect our democracy"".

""President Trump solicited foreign interference in our democratic elections, abusing the power of his office to seek help abroad to improve his re-election prospects at home,"" he said overnight.

— With AP

Do you have a story tip? Email: newsroomau@yahoonews.com.

You can also follow us on Facebook, Instagram and Twitter and download the Yahoo News app from the App Store or Google Play.","President Trump told his national security advisor he wanted to maintain a freeze on military assistance to Ukraine until it launched political investigations into his Democratic rivals, according to John Bolton’s description of their exchange in drafts of his forthcoming book, the New York Times reported Sunday.

The revelation challenges the defense offered by Trump and his attorneys in his Senate impeachment trial and raises the stakes as the chamber decided this week whether to seek sworn testimony from Bolton and other witnesses. Bolton, who acrimoniously left the White House a day before Trump ultimately released the Ukraine aid on Sept. 11, has already told lawmakers that he is willing to testify, despite the president’s order barring aides from cooperating in the investigation.

Democrats need at least four Republicans to vote with them to seek witness testimony. Those prospects looked unlikely in recent days and it’s unclear if the new revelations about Bolton’s book will sway any GOP senators.

Democrats quickly sought to ramp up the pressure on their Republican counterparts.

“John Bolton has the evidence,” tweeted Senate Minority Leader Chuck Schumer. “It’s up to four Senate Republicans to ensure that John Bolton, Mick Mulvaney, and the others with direct knowledge of President Trump’s actions testify in the Senate trial.”

The Associated Press has not confirmed the content of Bolton’s book. A person familiar with the matter told the AP the draft had been submitted to the White House for pre-publication review, which is standard for the work of former officials with security clearances. The person insisted on anonymity to discuss the sensitive subject.

Advertisement

Democrats accuse Trump of abusing his power in withholding the military assistance to Ukraine to push that country to mount investigations into Democrats, including former Vice President Joe Biden and his son Hunter, who served on the board of a Ukraine gas company, Burisma, while his father was in office.

On Saturday, the president’s attorneys said during their opening day of defense arguments that there was no evidence that Trump made the military aid contingent on the country announcing an investigation into Biden.

Trump on Wednesday told reporters in Davos, Switzerland, that he didn’t want Bolton to testify before the Senate.

“The problem with John is it’s a national security problem,” Trump said. “He knows some of my thoughts. He knows what I think about leaders. What happens if he reveals what I think about a certain leader and it’s not very positive and then I have to deal on behalf of the country?”

He added: “It’s going to be very hard. It’s going to make the job very hard.”",0.7553953
egyptian protesters issue morsi resignation ultimatum,egypt : police clash with pro-morsi protesters,0.75540483
A black dog is jumping from a cylindrical hay bale,a black dog jumps through the water .,0.755581
Something is being fried by a woman,a woman is slicing some vegetables .,0.75599533
The lady is carefully slicing up the meat,A woman is slicing an octopus,0.7561374
A woman is slicing a vegetable,The oriental lady is cutting a carrot into thin pieces,0.7562298
A dog is playing on the green grass,A light brown dog is running in the grass,0.7566943
Morsi backers defiant in face of Egypt govt threat,egyptian protesters issue morsi resignation ultimatum,0.75739706
Something is being fried by a woman,A woman is adding spices to some meat,0.7574383
a woman is cutting some herbs .,a person is cutting mushrooms with a knife .,0.7574998
A light brown dog is running in the water,animals are playing in water .,0.7575093
There is no woman cutting an onion,There is no man mixing vegetables in a pot,0.75800943
A dog running on the grass,a small black dog is in the grass .,0.7582184
The lady is carefully slicing up the meat,A woman is slicing some tomatoes.,0.75836456
A person is slicing a potato,A man is slicing tomatoes,0.7586054
A woman is slicing a vegetable,Something is being fried by a woman,0.7590786
animals are playing in water .,a dog shaking off water .,0.75945616
The man is playing a guitar,A man is making music with a flute,0.75963444
A person is wearing a blue shirt and walking barefoot on a tennis court,The person is walking,0.7601005
there is a gap between the bul and battery terminal .,the positive battery terminak is separated ba a gap from terminal 4,0.76042736
because bulb b and c were still in a closed path with the battery,bulb a is in a closed circuit with the battery without the y switch .,0.7604774
a person is cutting a meat .,A person is frying food in a pan,0.7605977
one killed in clashes at muslim brotherhood cairo offices,"9 killed , 168 injured in latest cairo clashes",0.7606342
A person on a bike is riding on one wheel only,One person is riding a bicycle in the sand beside the ocean,0.7611913
A dog is running on the sea shore,A light brown dog is running in the water,0.76174605
A small child is drinking water from a cup.,The small child is not wading through the water and is not being guided by another person,0.7619732
A man plays a trumpet.,A man is making music with a flute,0.76206154
A man is slicing some bread,a person is cutting a meat .,0.76215065
A man is playing the guitar.,A man is making music with a flute,0.762277
u.n. concerned at possible syria chemical weapons,u.n. experts have begun analyzing reports that state the syrian government was concealing a nuclear facility at the attacked site .,0.7626686
two dogs are wrestling on the ground in the snow .,"Two large dogs, a light colored one and a dark one, are quickly moving through snowy terrain",0.7628106
A man is playing the guitar.,a man is playing a keyboard piano .,0.7628745
"fear , confusion in algerian hostage crisis",algeria mulls international force for hostages,0.7629349
A person is slicing a potato,A woman is slicing some tomatoes.,0.7630887
a dog splashes in the murky water .,A light brown dog is running in the water,0.76314104
there is no gap between terminal 4 and the positive terminal,because there was no gap from the positive terminal of the battery,0.7636693
bulb a is in a complete circuit with the battery when switch z is closed .,because bulb b and c were still in a closed path with the battery,0.76389647
A man is playing the guitar.,A man plays a trumpet.,0.7640288
A woman is slicing a clove of garlic,Something is being fried by a woman,0.7640336
A person is slicing a potato,A man is slicing some bread,0.7640618
A woman is slicing some tomatoes.,A woman is slicing an octopus,0.76412106
the man is standing on the sidewalk in front of the horse .,a man is riding on a horse .,0.764168
a man is climbing a rope .,"A person is climbing a rock with a rope, which is pink",0.7641978
two brown horses standing in grassy field .,group of horses grazing in grassy field .,0.7643192
A woman is slicing a vegetable,A woman is not frying some food,0.7645383
a woman is cutting some herbs .,a woman cuts off a small piece of lemon rind .,0.76476324
someone is slicing a tomato .,a person is cutting some burrata cheese .,0.76487005
A woman is slicing garlic.,The lady is carefully slicing up the meat,0.7652991
there is no gap between terminal 4 and the positive terminal,the positive battery terminak is separated ba a gap from terminal 4,0.7653285
A person is slicing a potato,a person is cutting mushrooms with a knife .,0.7653464
because bulb b and c were still in a closed path with the battery,if the bulb is contained in a closed path with a switch,0.76543766
A dog standing in the water.,a dog shaking off water .,0.76607656
A group of people is on a mountain,A group of people is equipped with protective gear,0.7662066
a bird is flapping its wings in the water .,animals are playing in water .,0.7665087
A brown and black dog is running through the leaves,A brown and white dog is running across a brown field.,0.7666683
A woman is slicing a clove of garlic,A woman is adding spices to some meat,0.766781
There is no man spitting,There is no man spraying a super soaker into the mouth of a dog,0.76707995
A person is playing basketball on a team.,The players is maneuvering for the ball,0.7671503
a woman is slicing some vegetables .,A woman is not frying some food,0.7678173
a woman is slicing some vegetables .,a person is cutting a meat .,0.7681619
A dog running on the grass,"A dog, which is large and gray, is carrying a ball in its mouth and running across the grass",0.7684655
A black dog is hanging out in the grass and running with its tongue out,a black dog lies on the grass .,0.76847506
a woman is placing skewered food onto a cooker .,A woman is not frying some food,0.76910496
a cat is drinking some water .,a cat plays with a small bottle .,0.769145
Something is being fried by a woman,a woman is placing skewered food onto a cooker .,0.7691692
A woman is adding spices to some meat,The lady is carefully slicing up the meat,0.76941633
a bird is flapping its wings in the water .,a dog shaking off water .,0.76964355
A woman is slicing a vegetable,Onions are being sliced by the person,0.77018434
A person is slicing a potato,a man is slicing a tomato .,0.77065206
a man is playing a keyboard piano .,A man is making music with a flute,0.7706547
the battery is contained in a closed circuit and there is nothing in its pathway,there was a closed circuit,0.7707148
A person is strongly whisking eggs in a bowl,A woman is pouring eggs into a pan,0.7709147
A woman is slicing a vegetable,a person is cutting a meat .,0.7712972
one killed in clashes at muslim brotherhood cairo offices,egypt : child killed in cairo clashes after pro-morsi protest,0.77148855
A dog running on the grass,A little dog is running on the sand,0.77178633
A woman is slicing a clove of garlic,The lady is carefully slicing up the meat,0.7728565
A man is removing vegetables from a pot,There is no man mixing vegetables in a pot,0.77289116
the battery is contained in a closed circuit and there is nothing in its pathway,bulb a is in a complete circuit with the battery when switch z is closed .,0.77348894
A woman is adding spices to some meat,A woman is seasoning a ham,0.773494
A woman is chopping an onion,a man is cutting and onion .,0.77351177
Onions are being sliced by the person,a woman is slicing some vegetables .,0.7749319
A woman is adding spices to some meat,a woman is placing skewered food onto a cooker .,0.7751975
a dog splashes in the murky water .,animals are playing in water .,0.7754092
A dog is opening a can of food,The dog is not playing with a plastic container,0.7754925
a dog splashes in the murky water .,A dog standing in the water.,0.7761576
A woman is chopping an onion,a woman is cutting some herbs .,0.776231
a man is slicing a tomato .,A man is slicing some bread,0.7768354
a baseball player throws the ball .,a young pitcher is throwing the baseball .,0.77755094
A woman is slicing a clove of garlic,A woman is slicing some tomatoes.,0.77818286
because bulb b and c were still in a closed path with the battery,bulb a is not on the same path that bulb b and bulb c are .,0.7782598
bulb a is in a complete circuit with the battery when switch z is closed .,if the bulb is contained in a closed path with a switch,0.77868867
A woman is slicing a clove of garlic,A woman is slicing an octopus,0.77966845
A woman is slicing garlic.,A woman is slicing an octopus,0.78002036
a horse rider is riding a white horse .,a man is riding on a horse .,0.78024113
A person is slicing a potato,the woman is poking holes in the potato .,0.78141797
egypt : police clash with pro-morsi protesters,egypt : child killed in cairo clashes after pro-morsi protest,0.7819399
"fear , confusion in algerian hostage crisis",algeria hostage crisis ends ; death toll unclear,0.78259945
A woman is chopping an onion,A woman is slicing an octopus,0.7828547
A woman is slicing a clove of garlic,a woman is cutting some herbs .,0.78308415
because there was a gap in the terminals,there is a gap between the bul and battery terminal .,0.78308845
this is probably not a good idea but i will suggest it anyhow .,this sound like a very bad idea .,0.7835721
someone is slicing a tomato .,Onions are being sliced by the person,0.78394854
A person is slicing a potato,a person is cutting some burrata cheese .,0.78439677
A black dog is hanging out in the grass and running with its tongue out,a small black dog is in the grass .,0.78443617
A man is slicing some bread,A man is slicing tomatoes,0.7847556
A woman is not frying some food,A person is frying food in a pan,0.78520447
animals are playing in water .,Two dogs playing in the snow.,0.78554034
Boys are dancing in front of some people,kids are dancing .,0.786273
three dogs swim in the water .,animals are playing in water .,0.7869056
A woman is slicing a clove of garlic,A woman is chopping an onion,0.78714967
A man is playing the guitar.,The man is opening the guitar for donations and plays with the case,0.78762233
A man is peeling an onion.,Onions are being sliced by the person,0.78790104
A person is slicing a potato,A person is cutting an onion into pieces,0.788108
A person is taking a cat down from the ceiling,A person is brushing a cat,0.78883195
"weak protection laws for domestic workers : saudi execution : brutal , inhuman and illegal ? - cnn # p2 # p21 # tcot # ccot",saudi arabia defends maid 's execution,0.7890043
egypt ministry again urges end to pro-morsi protests,egypt : police clash with pro-morsi protesters,0.7896023
A ball is being caught by a dog in mid air,A brown and white dog is leaping in the air with a tennis ball in its mouth,0.7898985
There is no cyclist performing a jump on a bicycle,There is no bicyclist jumping on a pyramid-shaped ramp,0.79021764
a boy looking at a computer screen .,A boy is looking at a calendar.,0.79083437
Something is being fried by a woman,A person is frying food in a pan,0.79083955
The man is opening the guitar for donations and plays with the case,The man is playing a guitar,0.79105955
A woman is chopping an onion,There is no woman cutting an onion,0.79106295
there is no gap between terminal 4 and the positive terminal,terminal 6 is conncted to the positive terminal,0.79113615
a dog splashes in the murky water .,a dog shaking off water .,0.79128075
6 killed in u.s. drone strike in nw pakistan,pro-pak taliban warlord killed in us drone strike,0.7917887
Onions are being sliced by the person,a person is cutting a meat .,0.7919729
a person is cutting mushrooms with a knife .,a person is cutting some burrata cheese .,0.7921498
A dog with a blue muzzle is running around the yard with a jacket,A dog in a colored coat is running across the yard,0.79289234
"wtf ? ? » "" : at least 245 killed in brazil nightclub fire update : """,truly a sad day . at least 90 killed in brazil nightclub fire,0.7937968
there is no gap between terminal 4 and the positive terminal,the gap separates the positive battery terminal from terminal 1,0.7944938
egyptian protesters issue morsi resignation ultimatum,egypt ministry again urges end to pro-morsi protests,0.7949879
There is no dog catching a ball,A ball is being caught by a dog in mid air,0.79587424
there is no gap between terminal 4 and the positive terminal,terminal 6 is directly connected to the positive terminal .,0.79667854
A person is cutting an onion into pieces,a person is cutting a meat .,0.7969735
A dog is running on the sea shore,A dog running on the grass,0.79701424
A woman is slicing garlic.,a woman is cutting some herbs .,0.798614
this is probably not a good idea but i will suggest it anyhow .,it 's not a good idea .,0.79922956
A woman is slicing a vegetable,a woman is cutting some herbs .,0.79949856
Bread is being sliced by the man,A man is removing the garlic from some slices of bread,0.8006717
because there was no gap from the positive terminal of the battery,the positive battery terminak is separated ba a gap from terminal 4,0.8007201
someone is slicing a tomato .,a woman is slicing some vegetables .,0.80100465
A woman is slicing garlic.,A woman is slicing some tomatoes.,0.80106235
there is a gap between the bul and battery terminal .,because there was no gap from the positive terminal of the battery,0.8011575
someone is slicing a tomato .,a person is cutting a meat .,0.80132246
Someone is playing with a toad,a man is playing with frogs,0.802526
A woman is chopping an onion,A woman is slicing garlic.,0.80260426
there is a gap in the circut .,you can see where the gap is,0.8026892
"Two large dogs, a light colored one and a dark one, are quickly moving through snowy terrain",Two dogs playing in the snow.,0.8032739
A woman is slicing a vegetable,The lady is carefully slicing up the meat,0.8036182
A person is cutting an onion into pieces,A man is peeling an onion.,0.80429333
A person is doing acrobatics on a snowboard,A snowboarder is jumping off the snow,0.8057003
the battery is contained in a closed circuit and there is nothing in its pathway,bulb a is in a closed circuit with the battery without the y switch .,0.80675083
A woman is slicing a vegetable,A woman is chopping an onion,0.8068803
A dog running on the grass,A black dog is hanging out in the grass and running with its tongue out,0.8069936
if x and z are closed then it will create a closed path,it was a closed path,0.8075254
red double decker bus driving through the streets .,double decker passenger bus driving with traffic .,0.8076205
because there was a gap in the terminals,because there was no gap from the positive terminal of the battery,0.80799407
A woman is slicing a vegetable,someone is slicing a tomato .,0.80851495
A person is slicing a potato,a woman is slicing some vegetables .,0.80974185
The lady is carefully slicing up the meat,a woman is slicing some vegetables .,0.8098265
a woman is slicing some vegetables .,A woman is slicing an octopus,0.81016815
A person is slicing a potato,Onions are being sliced by the person,0.810333
"in desert outposts , border agents keep watch # elpaso # elchuco # lafrontera # mexico","at remote outposts , border agents sift for clues",0.81072426
A woman is slicing a vegetable,A woman is slicing a clove of garlic,0.8123996
a woman is cutting some herbs .,a woman is slicing some vegetables .,0.8124627
two white standard poodles play with a toy in the snow,Two dogs playing in the snow.,0.8129195
a person is cutting mushrooms with a knife .,a person is cutting a meat .,0.8130231
A woman is slicing a clove of garlic,a woman is slicing some vegetables .,0.81305724
A person is slicing a potato,The man is eating potato slices,0.8162588
A woman is slicing a vegetable,A woman is slicing garlic.,0.8165649
A woman is chopping an onion,Onions are being sliced by the person,0.8187325
A woman is chopping an onion,a woman is slicing some vegetables .,0.8199686
A woman is slicing a vegetable,A woman is slicing an octopus,0.82041585
A man is removing the garlic from some slices of bread,A man is slicing some bread,0.8207897
a black dog lies on the grass .,a small black dog is in the grass .,0.82097185
There is no man spitting,A man is spitting.,0.82122797
A woman is slicing a vegetable,A person is slicing a potato,0.82184553
a black faced sheep .,close up of a white sheep with a black head .,0.8236332
Nobody is folding a piece of paper,Somebody is folding a piece of paper,0.8256152
"wtf ? ? » "" : at least 245 killed in brazil nightclub fire update : ""","tragic . my thoughts and prayers go out to all ... "" at least 220 killed in brazil nightclub fire """,0.82603467
u.s. military deaths in afghanistan,nato solider dies in afghanistan,0.8261671
A dog is running on the sea shore,A little dog is running on the sand,0.8264159
terminal 6 is conncted to the positive terminal,because the positive batter terminal and terminal 6 were connected .,0.8264928
this sound like a very bad idea .,it 's not a good idea .,0.8268097
The man isn't operating a stenograph,A man is putting away a stenograph machine,0.82906723
a cat is drinking some water .,The cat is hungrily drinking milk,0.8294319
other separate unfortunately because of an accumulated resentment .,d ' other separate themselves unfortunately because of an accumulated grudge .,0.8300588
A woman is slicing garlic.,a woman is slicing some vegetables .,0.8305889
A person is slicing a potato,a person is cutting a meat .,0.8310915
The lady is carefully slicing up the meat,a person is cutting a meat .,0.83349043
a man is slicing a tomato .,A woman is slicing some tomatoes.,0.83351624
