sentence1,sentence2,similarity
iran ups oil swap with eastern neighbors,"ISLAMABAD: The first phase of admissions of the Allama Iqbal Open University (AIOU) that include Matric and FA programs for the Semester Spring, 2020 will be closed on Tuesday, March 3.



There will be no further extension in this date, it was announced.

The designated banks around the country have been directed to receive the admissions’ fee of Matric, FA as well as for admission in Certificate Courses and Open Tech Courses till the closing time on March 3.

The interested Pakistanis including those living in Saudi Arabia, Kuwait, Qatar, UAE, Sultanate of Oman, Bahrain have also been asked to enroll themselves in the on-going admission (spring, 2020).

Admission forms and prospectus for these programs could be downloaded from the University’s website.",0.4387419
four ladies in swimsuits play sand volleyball on the beach .,The men are not fist fighting in a ring,0.43958881
australian television reporter peter lloyd faces 3 new drug charges in singapore .,"the russia of putin has already lost 12 prominent journalists , murdered during the last six years .",0.44043633
A young couple is lying in bed,The man isn't operating a stenograph,0.4412834
A black dog is jumping from a cylindrical hay bale,A man is playing the guitar.,0.44213003
There is no girl jumping into the car,animals are playing in water .,0.44297785
"the ireland palestine solidarity campaign , of which mr o muireagáin was a member , welcomed his release .","shares of usa interactive rose $ 2.28 , or 7 percent , to $ 34.96 on friday in nasdaq stock market composite trading and have gained 53 percent this year .",0.4438239
cold wave cut murders in new york city significantly,"u ds boi ehn "" : piers slams guest over ar-15s """,0.44467145
"abuse of a father- "" which led to suicide """,russia convicts dead lawyer magnitsky in posthumous trial,0.44551802
"neighborhood joint | west village : 10,000 rubber stamps at ink pad in the west village","the technology-laced nasdaq composite index < .ixic > added 8.27 points , or 0.51 percent , to 1,633.53 .",0.44636583
A dog in a bucket is biting a tree which is probably a pine,it was a closed path,0.4472129
pro-pak taliban warlord killed in us drone strike,no missile evidence .,0.4480596
"when energy is born waves , now the big moves .",There is no bicyclist jumping on a pyramid-shaped ramp,0.4489069
"the act of governing , administrating",a siemens spokesman in germany refrained from commenting on the political aspect of the sale of the plutonium-processing facility .,0.4497536
"also in mosul , rebel gunmen on friday assassinated a sunni muslim tribal leader who backed the coalition .",out of touch and untrustworthy ?,0.4506002
south korea regrets north 's refusal of talks,portugal-china to strengthen scientific research ties,0.45144838
The religious people are enjoying the outdoors.,i have no problem with those that have money !,0.45229524
u.n. concerned at possible syria chemical weapons,"All known GEFs reconfigure the nucleotide-binding pocket, often opening it by rearranging the switch regions.",0.45314264
what the pope 's butler saw – aide arrested over vatican leaks,australian pm confident sounds are from flight 370,0.4539894
"make a crushing noise , possibly as the result of pressing or grinding .",Two dogs playing in the snow.,0.45483577
to move ( the head or body ) quickly downwards or away .,A surfer is riding the wave,0.4556833
a plane is landing .,A woman in blue jeans is standing in front of a group of children beside a house made of stone,0.45653063
i 'd say it depends what conditions you have .,touch or hold with the hands,0.45737773
the project of the motorway happened just when the most famous girl of eatonville had recovered her appeal .,the reason kindles exist : the onion 's tossing out an e-book biography of biden,0.45822525
The man is doing a wheelie with a motorcycle on ground which is mostly barren,A woman is crouching down next to a dog and is smiling at a young girl sitting on the sidewalk,0.45907205
feel the fear ... and do it anyway the book recommends to feel the fear .,"fail to keep or to maintain ; cease to have , either physically or in an abstract sense ;",0.45991892
dealbook : dell shares surge after report of possible buyout,Somebody is folding a piece of paper,0.46076643
agreed- no need to flog this deceased equine .,a dog swims after a tennis ball .,0.46161306
use cunning or deceit to escape or avoid .,a contract granting use or occupation of property during a specified time for a specified payment .,0.46246052
several cardinals stand in the snow .,a plane is landing .,0.46330667
An old man is talking to a leaf,a woman is peeling an orange .,0.46415383
f1 protests in bahrain,the judicial order accused raghad of funding terrorism .,0.46500105
ecuador yet to decide on assange 's asylum,A person is crouching and holding a camera,0.46584857
I think this is one of those things where you are just out of luck.,A chimp is missing the target,0.46669573
this frame contains nouns denoting aggregates of individuals. the aggregates may be described by an aggregateproperty .,A podium is where a man is speaking,0.4675434
"turkish pm , president clash over reply to protests",syrian regime denies role in houla massacre,0.46838832
A man is putting some food in a container,really ? man says he 's ' certain ' where hoffa is buried,0.46923745
"move faster , or cause to move faster",A football player in a purple jersey is breathlessly running with the ball for a touchdown,0.47008425
ecuador yet to decide on assange 's asylum,the event of proposing or volunteering something,0.47093105
The religious people are enjoying the outdoors.,i guess those are greek tickets ( εισιτηριον ) for excavation sites or museums .,0.47177815
australian pm confident sounds are from flight 370,the act of projecting out from something .,0.47262752
the hard upper part of the human nose,mandela 's condition has ' worsened over past 48 hours',0.4734729
A brown and white dog is running across a brown field.,a plane is landing .,0.47432005
exhaust by allowing to pull on the line .,"shine intensely ; emit a steady , even light from a source .",0.4751671
"sanford , ex-governor of south carolina , to run for congress",i 'd start by reading david allen 's book : getting things done .,0.47601488
A snowboarder is jumping off the snow,A man is spitting.,0.47686118
A woman is chopping an onion,A surfer is riding the wave,0.47770834
egypt ministry again urges end to pro-morsi protests,"for rape victims in india , police are often part of the problem",0.47855464
"zimmerman pulled over in texas for speeding , given warning",a motorcycles is parked near a wall covered with a graffiti scene of a cityscape .,0.47940433
No people is sitting around a fire at night,Two construction workers are sitting up on the top of a building,0.48024786
Adults and children standing and playing in front of a stair near a wooded area,There is no young Asian woman with pink gloves standing in the snow,0.48109657
this is probably not a good idea but i will suggest it anyhow .,"yes , it 's possible for a match to get tie after applying the d / l method .",0.48194355
"finally armstrong admits doping , and says he will testify","yes , i can tell you from personal experience that they certainly did whistle .",0.48279026
dzhokhar tsarnaev charged in boston marathon bombing,A football player in a purple jersey is breathlessly running with the ball for a touchdown,0.48363826
a crowd of people at an outdoor event,the hard upper part of the human nose,0.48448446
"in a 6-3 ruling , the justices said such anti-psychotic drugs can be used only in "" limited circumstances . """,there is a gap in the circut .,0.48533177
lugar and nunn are senators .,"the foreign secretary , margaret beckett , is at 40 / 1 , while the defence secretary , des browne , and the welsh and northern ireland secretary , peter hain are 50 / 1 .",0.4861785
permalink to two killed in germany train accident,batman and robin fly a helicopter over water .,0.48702687
a very retro living room with a television in it .,A person is eating in a restaurant,0.48787165
A blonds girl is surfing,a woman is peeling an orange .,0.48871946
A person is cutting an onion into pieces,The man is talking on the phone,0.48956603
often we are proud of representing europe 's citizens .,britain savors golden night on track,0.4904127
ukrainian officials barred from canada as protests continue,"meteorite hits central russia , more than 500 people hurt",0.49126136
"All known GEFs reconfigure the nucleotide-binding pocket, often opening it by rearranging the switch regions.",if the bulb is contained in a closed path with a switch,0.49210978
a person wearing a helmet sits on a bicycle on a sunny day .,There is no football player in a purple jersey running with the ball for a touchdown,0.4929555
a jockey riding a horse in a pen .,The man is playing a guitar,0.4938019
three young woman jumping into the air to catch a ball .,Two twin preteen kids are dueling with sticks,0.4946492
A young woman is riding a Bay hose in a dirt riding-ring.,A child is not wearing a coat and is carrying a red sled behind a child in a green and black coat,0.4954967
A few men are dancing,"Two large dogs, a light colored one and a dark one, are quickly moving through snowy terrain",0.4963423
a man is draining pasta .,A man in a white hat is getting off stage,0.4971911
he has appointed a working party to make the necessary changes to the policies of public spending and fiscal policies .,amendment no 7 proposes certain changes in the references to paragraphs .,0.498038
a bird is flapping its wings in the water .,the movement of the ball in the air is called swing bowling .,0.49888498
official says kenyan forces caused mall collapse,the terminal forced release of pressure built up during the occlusive phase of a stop consonant .,0.49973398
iran says un nuclear talks will continue,A podium is where a man is speaking,0.5005756
A young man on a bmx bicycle is jumping off a masonry pyramid,A man in a black hat is not reaching for a box,0.50142646
"weird , just the voice ? "" : voice of charlie brown arrested , charged . """,manning sentenced to 35 years for leaking government secrets,0.50227267
pro-pak taliban warlord killed in us drone strike,"at least 1 dead , 40 hospitalized in southwest heat wave",0.50312054
There is no dog catching a ball,Dirt bikers are not riding on a trail,0.50396687
"fear , confusion in algerian hostage crisis",haiti is a shithole .,0.5048145
A woman is unstitching with a machine,A football player in a purple jersey is breathlessly running with the ball for a touchdown,0.5056609
"A woman is putting on a cloak, which is very large, and concealing an extravagant dress","Two large dogs, a light colored one and a dark one, are quickly moving through snowy terrain",0.50650936
"also in mosul , rebel gunmen on friday assassinated a sunni muslim tribal leader who backed the coalition .",south africans mourn as mandela buried,0.50735587
The religious people are enjoying the outdoors.,".......... .......... .......... .......... .......... .......... .......... .......... .......... .......... .......... .......... .......... .......... .......... .......... .......... ..........

ALBUQUERQUE, N.M. — New Year’s Eve revelers can expect a chilly end to 2019.

But no travel problems are expected — at least through much of New Year’s Day.

A storm system moving in from the northwest could make things a little slick New Year’s night into Thursday. National Weather Service meteorologists said accumulating snow is expected in the western and central parts of the state, especially in the northern mountains. An accumulation of an inch or less is predicted for the Albuquerque metro on Thursday, with a little more than an inch expected in Santa Fe. A few additional inches are possible in the northern mountains. Rain mixed with snow is expected to spread across the eastern plains on Thursday.

Cold temperatures are expected to remain throughout the week, with a possible warming trend coming during the weekend. Temperatures are expected to be between 5 to 10 degrees below normal Tuesday into Wednesday. The weather service is urging residents to protect pipes, pets and plants over the next couple days. Highs in the 40s and lows in the mid and low 20s are expected through the remainder of the week in the Albuquerque metro. Low temperatures are expected to be in the teens or single digits in northern New Mexico.

Roads are expected to be slick in the western part of the state and in the northern mountains Wednesday night into Thursday. Gusty winds could also make travel hazardous along the I-40 corridor in eastern New Mexico.

Cold, drier weather is expected Friday, with warmer temperatures Saturday and much of Sunday before another storm system moves across the state bringing more chances of snow late Sunday into Monday.

ADVERTISEMENTSkip

................................................................",0.5082047
sheik doon salad ilmi stated that civilian casualties resulting from overnight mortar and rocket attacks are admitted to the hospital nearly every day .,pakistan begins demolition of bin laden compound,0.5090503
Girl playing in a puddle with her bare feet.,A few women are holding each other and dancing together,0.5098987
the man is standing on the sidewalk in front of the horse .,A person is eating in a restaurant,0.5107442
connolly said fbi agents in san diego and abroad spent thousands of hours investigating al-bayoumi .,- video shows usda official saying she didn 't give ' full force ' of help to white farmer date says 7 / 20 .,0.5115926
facilitator : and why is she the dumb child ?,a language unit by which a person or thing is known ;,0.51244044
A man is breaking boards made of wood with his hand,A man sitting in a back yard playing the guitar.,0.51328504
A person is cutting an onion into pieces,A cute panda is not lying down,0.5141332
"in a case in august , a 27-year-old laboratory worker in singapore developed sars .",dzhokhar tsarnaev charged in boston marathon bombing,0.5149797
A woman is slicing a vegetable,a girl is running on a desert path .,0.51582706
a man is playing with frogs,Two dogs playing in the snow.,0.5166749
A man is putting some food in a container,A woman is unstitching with a machine,0.5175244
Some cats are playing with each other,A man and a woman laughing.,0.51836807
"in fact , watching fox will tell you the exact opposite of what you are claiming .","""MediaMax performs EXACTLY as ""advertised"" to the companies who purchased it,"" Jacobs said in the statement.",0.51921386
A person is slicing a potato,a boy looking at a computer screen .,0.5200615
"It is difficult, if not impossible, to give a complete answer to this question.",touch or hold with the hands,0.52090555
a man catches a fish .,A man and a woman laughing.,0.521757
"In addition, miR-24 is one of the most abundant miRNAs in cervical cancer cells, and is reportedly up-regulated in solid stomach cancers.","in islamist-led egypt , coptic church names new pope",0.5226036
recovery or preservation from loss or danger .,"abuse of a father- "" which led to suicide """,0.52344465
"what happened in australia ... i went after guns . obama can , too .",many dead as asylum boat sinks off australia,0.5242951
two white standard poodles play with a toy in the snow,a small black dog is in the grass .,0.52514523
A brown and black dog is pointing the nose upwards,signal ( approval or interest ) by winking ; briefly shut one eye .,0.5259911
A person is slicing a potato,a man is playing with frogs,0.526837
asteroid zips between earth and satellites,A chimp is missing the target,0.5276847
A podium is where a man is speaking,A man is slicing tomatoes,0.52853537
An woman that is old is shaking hands with a man,A man is picking a can,0.5293828
A grey silky dog is sleeping in the grass and a brown dog is looking on,a dog swims after a tennis ball .,0.53022873
Someone is falling off the horse,A man and woman are dancing in rain.,0.531077
a state of extreme poverty .,study shows college degree ? s value during economic downturn,0.53192234
china fm hosts senior asean officials,china is investing in # education - # highered # edpolicy,0.5327708
he was the first speaker of the house in history to be fined .,manning sentenced to 35 years for leaking government secrets,0.5336201
A soccer ball is rolling into a goal net,A man is putting some food in a container,0.53446215
doctor and patient : when the doctor returns to doctoring,cause to appear in a new form .,0.5353097
israeli envoys summoned over settlement plans,the event of proposing or volunteering something,0.5361576
There is no man spraying a super soaker into the mouth of a dog,A person is strongly whisking eggs in a bowl,0.53700423
"the 2000 democratic platform supported "" the full inclusion of gay and lesbian families in the life of the nation . """,the gay and other ‘ modern ’ practices are rejected because nombrilistes .,0.5378519
what the pope 's butler saw – aide arrested over vatican leaks,"outside the court , sriyanto , who faces up to 25 years ' jail , denied he had done anything wrong .",0.5386961
issue bonds on something,engrave by means of dots and flicks .,0.5395497
a person is cutting a meat .,A dog in a colored coat is running across the yard,0.54039264
it is necessary to find other means .,take away a vital or essential part of something .,0.54125035
someone is slicing a tomato .,A dog is opening a can of food,0.54208684
a young woman leans over her plate at a meal .,An woman that is old is shaking hands with a man,0.54293466
"the 2000 democratic platform supported "" the full inclusion of gay and lesbian families in the life of the nation . """,uganda 's president museveni agrees to sign anti-gays bill,0.54378164
often we are proud of representing europe 's citizens .,"it was our day , how we wanted and it was wonderful .",0.54463065
A man is playing the guitar.,There is no one playing a piano,0.54547834
a strong current of air .,The players is maneuvering for the ball,0.54631954
The man is riding a horse by a creek,a person is cutting a meat .,0.547166
"outside the court , sriyanto , who faces up to 25 years ' jail , denied he had done anything wrong .","finally armstrong admits doping , and says he will testify",0.5480169
Adults and children standing and playing in front of a stair near a wooded area,People are sitting around dimly lit tables while smiling and laughing.,0.5488572
a brown dog laying on a blue cover .,a dog splashes in the murky water .,0.549713
a dog laying in a pet jacket .,a large brown dog is crouching in a grassy field .,0.5505576
A young man is talking to a leaf,The person is walking,0.5514042
The man is opening the guitar for donations and plays with the case,A person is crouching and holding a camera,0.55224955
a lady fastens someone 's ice skates in the snow .,A woman is adding spices to some meat,0.5530963
a boy is grinding a skateboard down a concrete wall .,A person is playing basketball on a team.,0.5539497
u.n. concerned at possible syria chemical weapons,Syrian forces and rebels clash in coastal province,0.5548034
"find out or be informed of a new information , understand or realize",a language unit by which a person or thing is known ;,0.5556385
two dogs are wrestling on the ground in the snow .,A woman is crouching down next to a dog and is smiling at a young girl sitting on the sidewalk,0.5564877
egypt : police clash with pro-morsi protesters,indonesia police shoot dead suspected militants in bali,0.55733454
A kid is smiling at the camera and swimming underwater,A light brown dog is running in the water,0.5581778
the boy hops from one picnic table to the other in the park .,A sad man is jumping over a small stream to meet his companion on the other side.,0.55902195
a small black dog is in the grass .,The little dog is grabbing the bedroom slipper with its mouth funnily,0.55987716
An empty office chair in a cubicle.,a women sitting in a chair at christmas holding make up .,0.56072044
a lady fastens someone 's ice skates in the snow .,A woman is wearing a long black coat and a brown hat and is walking past a park with a lot of blooming trees,0.56156796
A woman is slicing a clove of garlic,A person is playing basketball on a team.,0.5624101
A person is doing acrobatics on a snowboard,The man is mixing whipping cream.,0.56326365
The man isn't operating a stenograph,There is no woman cutting an onion,0.5641105
The man is not climbing up a rope,A man is playing a trumpet brightly,0.56495845
a young woman leans over her plate at a meal .,A woman is chopping an onion,0.56581
a bird is flapping its wings in the water .,a large brown dog is crouching in a grassy field .,0.5666523
adherence to non-proliferation obligations will enhance mutual trust and foster international cooperation in nuclear energy .,south korea confirms that north korea has conducted controversial third nuclear test,0.5675014
A woman is unstitching with a machine,A group of people is equipped with protective gear,0.5683498
The person is walking,A dog in a colored coat is running across the yard,0.56919575
a man in a red striped soccer shirt heads a ball .,Two men are playing a game of Scrabble together.,0.5700433
An woman that is old is shaking hands with a man,a dog shaking off water .,0.5708915
"A woman is putting on a cloak, which is very large, and concealing an extravagant dress",A woman is dancing near a fire,0.571745
"axelrod died in his sleep of heart failure , said his daughter , nina axelrod .",death toll rises in russia plane crash,0.5725828
A brown and white dog is leaping in the air with a tennis ball in its mouth,A woman is crouching down next to a dog and is smiling at a young girl sitting on the sidewalk,0.5734338
A cute panda is not lying down,A young child is lying down on a gravel road that is covered with dead leaves,0.5742745
"fail to keep or to maintain ; cease to have , either physically or in an abstract sense ;","recover , return to former state",0.5751227
"pass by , over , or under without making contact .",signal ( approval or interest ) by winking ; briefly shut one eye .,0.57596314
"finally armstrong admits doping , and says he will testify",physicist danilov was convicted of selling classified information on space technology to china .,0.5768071
Two men are playing a game of Scrabble together.,A boy is spanking a man with a toy weapon,0.57766473
A person is eating in a restaurant,The dog is not playing with a plastic container,0.5785129
The man is not climbing up a rope,Dirt bikers are not riding on a trail,0.5793588
Someone is playing with a toad,The man isn't operating a stenograph,0.58020973
A group of kids is playing on a colorful structure,four kids holding hands jump into a swimming pool .,0.58105063
a bird is flapping its wings in the water .,A person is brushing a cat,0.581895
a man is assembling speaker parts .,A person is playing basketball on a team.,0.582751
someone is slicing a tomato .,a person who plants bombs .,0.58359057
A man is cutting apple by his hand.,The man is eating potato slices,0.5844474
There is no cyclist performing a jump on a bicycle,There is no man skiing down a snowy hill,0.58528733
A woman is receiving volleyballs,A man is hugging and kissing a woman.,0.5861293
The man is riding a horse by a creek,A man is playing a trumpet brightly,0.5869881
The violin is being played by a woman,A person is slicing a potato,0.58782613
mourners clash with police in tunisia,61 dead in ivory coast stampede,0.5886708
a man puts three pieces of meat into a pan .,a man dressed in a pale scarf with a stick .,0.58952296
A person on a bike is riding on one wheel only,A person is reading the email,0.59037787
recovery or preservation from loss or danger .,the cognitive processes and capacity to remember .,0.59122044
a man is cutting and onion .,A man is making music with a flute,0.59206533
A dog is barking,Asian children are playing with a dog.,0.59290004
The violin is being played by a woman,A person is frying food in a pan,0.5937568
The man is opening the guitar for donations and plays with the case,The players is maneuvering for the ball,0.5946038
A man is peeling an onion.,A person is strongly whisking eggs in a bowl,0.5954468
a young woman with a black top and a necklace .,A woman is not frying some food,0.5963099
A person is taking a cat down from the ceiling,Something is being fried by a woman,0.59714645
A man is performing a card trick.,Two men are fist fighting in a ring,0.5979837
There is no man spitting,a man blowing a large bubble .,0.5988457
A group of kids is playing on a colorful structure,two kids splashing in the water .,0.59969324
A man is working on his farm.,a shirtless man playing football on a lawn .,0.60053915
learn by reading books .,i think a learning attitude is the founding skill of a self-taught person .,0.6013987
two buses parked on a street .,a motorcycles is parked near a wall covered with a graffiti scene of a cityscape .,0.60223603
a lady fastens someone 's ice skates in the snow .,a person is cutting a meat .,0.60307515
because there was a gap in the terminals,terminal 1 and terminal 2 possess no difference,0.6039109
There is no woman cutting an onion,a person is cutting some burrata cheese .,0.6047709
A cute panda is not lying down,A dog is opening a can of food,0.6056291
A man with a crutch lying on the ground.,Someone is falling off the horse,0.6064642
The oriental lady is cutting a carrot into thin pieces,A person is taking away the meat in the skillet,0.6073124
There is no one playing a piano,No dog is in the sand that is blowing in the wind,0.6081648
A man pours rice into a pot.,A man is spitting.,0.6090125
A woman is seasoning a ham,There is no woman preparing an egg in a skillet,0.6098544
