sentence1,sentence2,similarity
"Among the popular stars of the Gen-Z, Sara Ali Khan is the one who has filmmakers lining up to cast her in their films. Despite being just 3 films old, Sara enjoys a massive fan base and the star is considered to be one of the style icons of the youth. However, despite all of it, the gorgeous Love Aaj Kal star revealed that there was once a film narration that she wanted to escape at all costs and was even willing to fake a heart attack but her mom Amrita Singh talked sense into her.

Yes, in a candid conversation with East India Comedy, Sara revealed that once she was stuck in a very lengthy narration and the filmmaker was going on and on about the film. However, the Love Aaj Kal star shared that she wanted to escape the narration even by going to the extreme length of wanting to fake cardiac arrest. Sara described the episode and said, “There was this one time. I am not going to say much…because he said so much!”

(Also Read: Sara Ali Khan looks like a spitting image of mom Amrita Singh as she recreates the latter's pose; See PHOTO)

She went onto reveal that she called her mom, Amrita Singh from the washroom and told her that she is ready to fake cardiac arrest to get out the narration. However, the Love Aaj Kal star was told by the senior star to sit through the narration and to be professional till the end. Sara recalled the incident and said, “I went to the restroom with my phone, three hours in, and I told my mom, ‘Look, I know that we are all professional and we should be thankful for these opportunities… But can I pretend to have a cardiac arrest? Is that allowed?’ She said no, so I asked, ‘Should I faint? Should I throw up? What do I do?’ She told me that I have to go back with professionalism and continue till the end.”

Sara Ali Khan's latest photo:

Later, Sara revealed that she continued to hear the filmmaker for five hours and then when she went home, she told her mom Amrita that she hates her now and she doesn’t want to talk and just needs sleep. Well, surely the starlet tried her best to escape the situation but was talked out of it by her mom. On the work front, Sara’s recent release is Kartik Aaryan starrer Love Aaj Kal by Imtiaz Ali. Next, Sara will be seen in David Dhawan’s Coolie No 1 with Varun Dhawan. It will hit the screens on May 1, 2020. Apart from this, Sara recently announced a film with Dhanush and Akshay Kumar titled Atrangi Re. It will release on Valentine’s Day 2021.",a man in a black hat standing in front of a brick wall and a sign,0.2500262
britain rejects syria military action,circuit 2 is not a short circuit because is shows connection to the bulb .,0.25093937
a skier is jumping in the air over a snowfield near a mountain range .,"they include two kuwaitis and six palestinians with jordanian passports , and the remainder are iraqis and saudis , the official said .",0.25185445
"what are the bus ( coach ) connections from thessaloniki , greece to tbilisi , georgia ?",A child is running in and out of the ocean waves,0.25276667
The man is driving a car,"they include two kuwaitis and six palestinians with jordanian passports , and the remainder are iraqis and saudis , the official said .",0.2536798
putin wins disputed russian presidential election,gartner analysts said that businesses are not yet feeling confident enough to upgrade corporate pcs .,0.25459328
A young man is running away from the fishing line,syrian army retakes historic crusader castle,0.25550655
"they include two kuwaitis and six palestinians with jordanian passports , and the remainder are iraqis and saudis , the official said .",a man is playing a key-board .,0.25641885
a man is busting concrete .,syria tells russia some troops have pulled out of homs,0.25733268
chinese court upholds death penalties for mekong murderers,a cow is eating grass .,0.25824657
two terriers play on the wood floor of their home .,"the gay and other practical "" modern "" are rejected , laws .",0.25916058
a dog is running along the grass .,goa building collapse death toll touches 15,0.26007396
A man in a red shirt is doing a trick with a skateboard,Two women walk down the sidewalk in the afternoon.,0.2609869
putin stated that russia could discard the treaty entirely if western nations refuse to ratify its amended version .,not connected to positive battery,0.26190123
People are on a beach full of sand by the ocean and are enjoying a day full of sun,"internet activist # aaronswartz , creator of # rss , is dead at 26- suicide . was the pressure of pending lawsuits too much ?",0.26281682
"Google last week said that this summer Chrome will remove resource-hogging web advertisements from websites, including ads that mask unauthorized crypto-mining operations.

Arguing that a very small number of online ads - three-tenths of a percentage point of all on the web - disproportionately account for major portions of total network and CPU consumption, Google plans to scrub sites of such ads starting with a Stable build of Chrome near the end of August.

Chrome 85 is scheduled to release on Aug. 25, and would be the most likely version to debut the feature.

""These ads (such as those that mine cryptocurrency, are poorly programmed, or are unoptimized for network usage) can drain battery life, saturate already strained networks, and cost money,"" Marshall Vale, a Chrome product manager, wrote in a May 14 post to the Chromium blog.

When Chrome detects one of the über-aggressive ads, the browser will unload the content from the ad's frame - the portion of the page in which it's displayed - and refill the space with an error message stating ""Ad removed,"" along with a link to more information.

After copious measurements, Google decided to strip out any ad that consumed 4MB of network data, used the CPU during half of any 30-second span or tallied a total of 60 seconds of CPU usage. Those bars were so high that they affected only 0.3% of all ads, but, Google contended, such ads accounted for 27% of all ad-generated network traffic and 28% of all ad-related CPU usage.

Other browsers have addressed bad actors, including crypto-miners, using different approaches. Mozilla's Firefox, for example, blocks crypto-miners by targeting domains known to harbor such scripts. (Mozilla relies on domain lists produced by Disconnect.) It's not surprising that Google took a metrics-based route here; it typically bases decisions, or says it does, on data collected by Chrome and/or its search engine.

Chrome users can try out this ""Heavy Ad"" detection and removal prior to version 85 via the chrome://flags option page. Set the Heavy Ad Intervention flag (which also goes by #enable-heavy-ad-intervention) to Enabled and relaunch the browser.

Site developers and ad content creators should use the time between now and late August to test and, if necessary, alter first-party advertisements, Google said. ""Our intent with this extended rollout is to give appropriate time for ad creators and tool providers to prepare and incorporate these thresholds into their workflows,"" said Vale.

Detailed instructions on how to track removed ads using an API as well as how to test the resource usage of ad content were provided in this support document.",a woman is sitting near a flower bed overlooking a tunnel .,0.26372793
a man is holding up and talking about a gray you tube t-shirt .,the brown and white dog is walking in shallow waters .,0.26464164
There is no man loading a rifle with bullets,Two poodles are in the snow and one is jumping,0.26555467
vehicles ablaze in collapsed japan tunnel,The man is riding a horse by a stream,0.26646888
A large duck is perching over a rocky stream,two men are packing suitcases into the trunk of a car .,0.267382
The boy is playing in the mud,eu heaps new sanctions on syria,0.2682961
malaysia 's ruling coalition wins majority,a woman is sitting near a flower bed overlooking a tunnel .,0.2692091
"israel airstrikes kill hamas commander , 5 others","the pagerank is computed iteratively , and it is found that the pagerank values converge fairly rapidly .",0.27012262
i 'm shocked he was even elected ...,two people riding their bikes on a hill .,0.27103594
A person is wearing a blue shirt and walking barefoot on a tennis court,Two poodles are in the snow and one is jumping,0.27194914
The kitten isn't eagerly drinking some milk from the bowl,officials in estonia including prime minister andrus ansip have claimed that some of the cyber attacks came from russian government computers including computers in the office of russian president vladimir putin .,0.27286148
A small monkey is walking in the river,blast kills 10 young girls in eastern afghanistan,0.27377602
obama lashes north korea as pariah state,"ozbus offer a 29 week tour of south america , starting and finishing in quito .",0.27469113
"the pagerank is computed iteratively , and it is found that the pagerank values converge fairly rapidly .",A woman is sitting and looking at the waterfall,0.27560338
cause to be perplexed or mentally confounded .,There is no young girl in a blue shirt walking on the sidewalk and holding up a pink sign,0.27651778
A dog is jumping on a trampoline,There is no woman adding spices to some meat,0.27742967
eu extends sanctions against russia,newark mayor rescues neighbor from burning house,0.27834344
fitch restores ford credit to investment grade,The man is kick boxing with a trainer,0.2792578
"in millville yesterday , mayor james quinn ordered all city flags flown at half-staff for the next 30 days .",A woman is slicing garlics.,0.28017038
A woman is slicing garlics.,"state dept. issues wide travel alert , says terror attack possible",0.28108454
A boy is playing a wind instrument,A topless woman is being smeared with brown substance and a nobody is in the background,0.28199822
dynamic programming solves problems by combining the solutions of subproblems .,"sorry , you just don 't .",0.28291053
A man is sprinkling seasoning on several sliced and buttered loaves of bread,signing of the agreement is a peripheral issue of the meeting of chiefs of defense staff from the 26 ally countries of nato .,0.28382483
There is no cat eating corn on the cob,a couple posing on a red and yellow motorcycle .,0.28473797
""" the future of ba is in the hands of the negotiators , "" eddington told british broadcasting corp. television on sunday .",russia destroys over 75 % of its chemical weapons stockpile,0.28565198
"israelis , palestinians resume talks in us",A man in a red uniform is making a jump in a dirt bike race,0.2865652
Two poodles are in the snow and one is jumping,"he was listed last night in critical but stable condition at kings county hospital center , police said .",0.28747863
a woman is sitting near a flower bed overlooking a tunnel .,"Philippines, Canada pledge to further boost relations",0.2883926
The sun is shining on the face of the girl who is in a yellow dress,rooney helps man united beat everton 3-0 in premier league,0.2893053
rooney helps man united beat everton 3-0 in premier league,A girl is bungee jumping.,0.2902182
cats ( and all animals in general ) do not understand the concepts of order or tidiness .,"stocks rise early after greek deal , then flatten",0.2911329
asia stocks fall ahead of greek debt deal deadline,mandela remains in hospital,0.292046
The sun is shining on the face of the girl who is in a yellow dress,egypt court turns down mubarak 's release request,0.29296002
A man is doing some tricks with a soccer ball,South Korea declares end to MERS outbreak,0.29387367
a sea turtle is hunting for fish .,a man and woman walking past a record shop,0.29478654
A man dressed in a pale scarf with a stick.,a more equal military ? bring back draft,0.29570004
There is no man loading a rifle with bullets,what could be causing gfci breakers and receptacles to trip ?,0.2966142
france fears extremists will benefit from egypt violence,"board chancellor robert bennett declined to comment on personnel matters tuesday , as did mills .",0.29752722
sylvester stallone 's son found dead at home,"@ frank apisa , what you want to call it is up to you .",0.29844084
electronic data systems corp. thursday said the securities and exchange commission has asked the company for documents related to its large contract with the u.s. navy .,a person walks a dog along the water 's edge .,0.29935423
"downstream at mount vernon , the skagit river was expected to crest at 36 feet -- 8 feet above flood stage -- tonight , burke said .",a white curly haired dog runs with a stick in it 's mouth .,0.30026746
mandela remains in hospital,( nautical ) brace consisting of a heavy rope or wire cable used as a support for a mast or spar .,0.3011812
three boys playing soccer in a field,A woman is cracking eggs.,0.30209556
A woman is cracking eggs.,korobeynichev 's laboratory worked with other scientific institutes .,0.30300796
A small boy is playing with a dog,you 've pretty much answered your own question .,0.3039219
A kitten is getting bored,the sovereign and his advisers who are the governing power of a state .,0.30483475
white house backs gay marriage,A large duck is perching over a rocky stream,0.30574882
a boy in a blue shirt and blue jeans runs across a playground,"365 days from january 1 to december 31 , the gregorian calendar",0.30666187
a skier is jumping in the air over a snowfield near a mountain range .,osama bin laden movie to be filmed in india,0.30757713
two black dogs walking through the snow .,a person is peeling a potato with a potato peeler .,0.30848873
tokyo shares open higher following strong u.s. performance,"internet activist # aaronswartz , creator of # rss , is dead at 26- suicide . was the pressure of pending lawsuits too much ?",0.30940297
2 pussy riot members reunited in krasnoyarsk,( music ) the section of a composition or movement ( especially in sonata form ) where the major musical themes are developed and elaborated,0.31031534
A white dog running over a bridge.,There is no girl wearing a t-shirt and keeping her mouth open,0.31122947
how do i install a new interior partition wall ?,Gunmen kill nine people in northwest Pakistan,0.31214228
88 percent of the liberal democratic party supports economic sanctions .,A brown puppy is gnawing a metallic post that is stuck in the ground,0.31305772
the verses above from leviticus are in a section of the bible that lists immoral acts and the penalties for them .,tech sector heats up : google and ibm post strong earnings,0.31397057
aust shares up 1 % after interest rate cut,Two black dogs are playing in a grassy plain.,0.3148834
discipline in personal and social activities .,"Marysville, CA (95901)

Today

Cloudy skies this evening will become partly cloudy after midnight. Low 58F. Winds S at 10 to 20 mph..

Tonight

Cloudy skies this evening will become partly cloudy after midnight. Low 58F. Winds S at 10 to 20 mph.",0.315797
a boy looking at a computer screen .,give suck to ; receive suck .,0.3167104
syria welcomes iran 's nuclear deal,The dog is running through a field.,0.3176236
"the circumstances surrounding a shooting before the release of the hostages are still unclear : the kidnappers were close to putting an end to the kidnapping , before the sudanese army killed six of the kidnappers without warning , according to an egyptian security official .",a man is eating a food .,0.31853738
"38 killed in rains , flash floods in pakistan",a cat on its back looking at the camera .,0.319451
come into the possession of .,"The boy also sprayed the room full of retardant from fire extinguishers, which made it hard to see, the chief said.",0.3203643
A man is demonstrating how to work with clay while at least two people observe.,"awe - one of the original "" bloggers "" passes away . pauline phillips , adviser to millions as dear abby , dies at 94",0.32127786
a cat sleeping on the coach with a pillow behind it .,soccer-france to host australia for first time in october,0.3221914
new syria opposition chief wants no-strings aid,A man is diving into a pool,0.32310525
A large flute is being played by a man,"the ideology was built around violent expansion , so yes - violent expansion .",0.32401788
how to remove a tick on a dog ?,"The submission was on Monday, but the announcement was made Friday at the International Broadcasting Convention in Amsterdam.",0.32493153
There is no woman slicing a tomato,A man in a red shirt is doing a trick with a skateboard,0.32584566
two boys are driving .,"he also said shockey is "" living the dream life of a new york athlete .",0.32675874
"india , us to hold talks on china next week",blast kills 10 young girls in eastern afghanistan,0.32767215
a woman is mixing ingrediants .,two men are packing suitcases into the trunk of a car .,0.32858577
cats ( and all animals in general ) do not understand the concepts of order or tidiness .,The woman is putting down the kangaroo,0.3294984
karzai to visit pakistan for taliban peace talks,bulb a and bulb c are not contained in the same closed path,0.3304127
the period during which something is functional ( as between birth and death ) ;,a couple posing on a red and yellow motorcycle .,0.3313262
A young girl with a heart tank top is raising her hands as she is playing on a slide,bulb a and bulb c are not contained in the same closed path,0.3322397
Two males are standing on a cliff edge and one is jumping into the water,"yes , you should stretch before running , but not the sit down and reach kind of stretching .",0.3331531
a man puts seasoning in a bowl of water .,Two dogs are running and carrying an object in their mouths,0.33406672
"INN turned to experts in the market to get a sense of what’s in store for investors looking to plug into the gaming industry in the new year.









Gaming and the esports industry — characterized by massive video game tournaments — saw unprecedented growth in 2019 as investors recognized opportunity.

Now, heading into 2020, the gaming sector is poised to further shift into a lucrative market as increased interest supports the growth of players in the space.

Here the Investing News Network (INN) turns to experts in the market to get a sense of what’s in store for investors looking to plug into the esports industry in the new year.

Why are Google and Apple are investing heavily in the gaming market? Read our FREE outlook report on the gaming market! Give me my free report!

Gaming outlook 2020: A closer look at the numbers

The esports industry is looking to capitalize on a successful 2019 moving into 2020 and beyond.

In its 2019 global games market report, gaming research firm Newzoo states that the international gaming market could be worth US$196 billion by 2022.

Mobile games in particular are projected to generate US$95.4 billion by 2022, driven primarily by smartphone activity. Cross-platform titles such as Mario Kart Tour on iOS and Android, a general increase in smartphone users and improvements to hardware and infrastructure are factors that will lead to the projected growth, according to the firm.

The console segment, on the other hand, is set to reach US$61.1 billion in 2022, Newzoo estimates, boosted by the upcoming generation of Xbox and PlayStation systems, created by Microsoft (NASDAQ:MSFT) and Sony (NYSE:SNE,TSE:6758), respectively.

PC gaming will be a bit slower in the coming years, according to the researchers, though it is gaining traction and could be valued at US$39.5 billion over the next two year period.

In a previous interview with INN, Erik Dekker, senior vice president and portfolio manager with Dekker Hewett Group at Canaccord Genuity, said, “Gaming is bigger than film box offices, bigger than television, bigger than digital music. I think it’s about a US$116 billion market at this time.”

Gaming outlook 2020: The growth of team organizations

In esports, organizations like Team Liquid and OG are big generators of cash for the industry. Team Liquid, which has teams in many of the top esports leagues, currently has a merchandise collaboration with Marvel, and OG just announced a Counter Strike: Global Offensive team following its big Dota 2 win.

Team support and attachment have been reflected in the sheer amount of interest in gaming tournaments, another important revenue stream for esport companies.

In August, the Dota 2 The International 9 tournament had the world’s largest prize pool in history at a whopping US$34.3 million in winnings, and OG took home the top prize.

But organizations are evolving to rely on more than just their athletes and tournaments — instead, they’re taking a holistic approach to branding and maintaining a public image.

Why are Google and Apple are investing heavily in the gaming market? Read our FREE outlook report on the gaming market! Give me my free report!

“It’s going to ultimately come down to teams that can create brand lifestyles, create great content programming and diversify the revenue streams to find more profitability,” Daniel Mitre, CEO of New Wave Esports (CSE:NWES), told INN via email.

Mitre said the impressive growth of the sector has already led heavy hitters in gaming to throw their hats into the ring. The executive explained that companies like Activision Blizzard (NASDAQ:ATVI) and Riot Games, a subsidiary of Chinese conglomerate Tencent (HKEX:0700), have carefully crafted plans attached to their esports franchises and leagues.

“None of this movement around big games, AAA publishers and developers is coming to a slow,” said Mitre. “In fact, it’s just going to start picking up further.”

This sentiment was shared by another expert in gaming who is optimistic about the market’s trajectory.

Haywood Securities investment banker Sean MacGillis said the skill of the gaming industry is in the flexibility of its revenue channels, which include everything from merchandise and ticket sales to advertising and sponsorship revenue.

“The ability to monetize games is an order of magnitude larger than the ability to monetize traditional forms of content,” MacGillis explained.

Gaming outlook 2020: Possible concerns in the new year

Some experts have noted possible pitfalls for the industry, despite its recent levels of success.

For Nick Mersch, associate portfolio manager at Purpose Investments, the biggest risks for the space could come with the hypothetical collapse of the Overwatch League, one of the biggest leagues in the sector. Mersch said a downturn for the league could turn off existing and prospective investors.

“A lot of traditional sports owners wrote huge checks into teams in this league, and if they get burned here it will be difficult to attract capital back to the space,” Mersch told INN.

According to a report from Variety, viewers for the Overwatch League Grand Finals grew by 16 percent in 2019, with the event reaching 1.12 million average viewers.

Mersch said he’s also keeping his eye on the overvaluation that has plagued esports, pointing to a recent Forbes list ranking “the most valuable companies in esports” that still seems to exaggerate the values of some organizations on it, according to the expert.

Why are Google and Apple are investing heavily in the gaming market? Read our FREE outlook report on the gaming market! Give me my free report!

Other concerns have larger political implications. The ongoing US-China trade war dampened the growth of the sector, according to Trevor Doerksen, CEO of ePlay Digital (CSE:EPY), and could continue to do so into 2020, especially given China’s place as one of the world’s largest hubs for gaming.

In 2019, it was projected that US$36.5 billion was spent on gaming in China, according to Newzoo.

“Geopolitical forces and the US-China trade war muted global collaboration and access to markets, and important data that would help better understand and grow esports in 2019,” said Doerksen.

The executive said there could be better access to content, games and data across both markets if the relationship between the two countries improves in 2020.

Gaming outlook 2020: Investor takeaway

Mersch said moving forward, the most important factor for gaming will be the work done by data firm Nielsen, owned by The Nielsen Company (NYSE:NLSN), in its esports division, which works to get accurate information on engagement and viewership data.

In his view, Nielsen’s work could help close the existing gap between how the industry is growing and how it’s monetizing that growth, Mersch told INN.

“To close this gap, Fortune 500 companies need actionable return of investment metrics in order to justify more (spending) in the space. Nielsen and other data analytic companies can provide this.”

In terms of the overall health within the sector, Mitre told INN that the increasing popularity of gaming and its viewership will help in building a strong foundation for an interesting investment market.

“We’ve always had this propensity to watch people play better than us, whether it’s standing at the arcade and watching someone play Street Fighter, or the emergence of a Twitch and YouTube influencer space watching other people play video games,” said Mitre.

Don’t forget to follow us @INN_Technology for real-time news updates!

Securities Disclosure: I, Danielle Edwards, hold no direct investment interest in any company mentioned in this article.

Editorial Disclosure: The Investing News Network does not guarantee the accuracy or thoroughness of the information reported in the interviews it conducts. The opinions expressed in these interviews do not reflect the opinions of the Investing News Network and do not constitute investment advice. All readers are encouraged to perform their own due diligence.",free from obligations or duties .,0.3349807
