sentence1,sentence2,similarity
a tan puppy being petted .,A dog standing in the water.,0.6473949
The man is doing exercises in a gym,A man is diving into a pool,0.64831257
I've done this many dozens of times.,the vast amount was done in person or over the phone although i did put my concerns on paper a few times .,0.64920855
There is no one typing,Nobody is slicing a piece of bread,0.6501485
A baby is playing with a doll,An animal is playing with a small bottle,0.65104514
the brown and white dog is walking in shallow waters .,two dogs playing by the shore .,0.6519592
""" in it was a mental illness , now what are they teaching you ? """,cause to be perplexed or mentally confounded .,0.652892
two dogs running in the dirt,two terriers play on the wood floor of their home .,0.6537766
the bulb takes away the path .,A person is not making a bed,0.6547028
becaquse there was a gap in the connection,i hope it works out in the end ...,0.6555846
influence or control skillfully and often deviously .,( cause to ) become less tense ; rest or take one 's ease .,0.6565287
The black dog is playing with the brown dog on the sand,A black dog is leaping from a hay ball to another hay ball,0.65745634
Nobody is folding a piece of paper,There is no man playing guitar,0.6583268
provide with a toggle or toggles .,give away something that is not needed,0.65927976
a woman is cutting a jalepeno .,a woman is adding sauce to some food .,0.66018564
a white curly haired dog runs with a stick in it 's mouth .,Two dogs are running and carrying an object in their mouths,0.6610157
A young boy is jumping into water,A child is running in and out of the ocean waves,0.6620062
"a piece of evidence indicates that an event occured , or metonymically , entity had formerly existed , in a location .","cause to have , in the abstract sense or physical sense .",0.6629331
come into the possession of .,"deliver a sharp blow , as with the hand , fist , or weapon ;",0.6638327
You have to do what is right for you.,i hope it works out in the end ...,0.6647571
A man is demonstrating how to work with clay while at least two people observe.,A man is talking,0.66566867
A boy is comfortably sitting in a room and playing a piano by a lamp,a cat is playing a piano .,0.66655993
attract ; cause to be enamored by ( one 's ) nature .,a journey for some purpose .,0.6674891
edit so as to block the truth ; prevent distribution,verify something by comparing to a standard,0.6684027
a line leading to a place or point ;,move into and stay in a particular position,0.6693275
A boy in a jacket playing.,A boy is sitting on the ground,0.6702781
it is a democracy with regular changes in government many of them due to coup .,influence or control skillfully and often deviously .,0.67115617
the official currency issued by a government or national bank .,"what is the meaning of "" $ n industry "" ?",0.67206806
train gliding on tracks .,Two vehicles are going towards the camera.,0.67299426
Two poodles are in the snow and one is jumping,two dogs playing by the shore .,0.67384124
it breaks the closed path .,the switch has to be contained in the same path as the bulb and the battery,0.6747255
a man and a woman holding hands walking along the beach .,a black man and his dog on the beach .,0.6757278
a person is peeling a potato with a potato peeler .,someone is slicing a tomato .,0.67665684
Two black dogs are playing in a grassy plain.,two gray dogs run together over the green grass .,0.67751276
Two dogs running on the shore.,Two black dogs are playing in a grassy plain.,0.6784879
The man is standing steadily next to a birdcage,man on steps,0.679399
the cause or instigation of something,provoke or stir up .,0.680229
forex & gold 19 july 2012,"The dollar fell as low as $1.1624 per euro from $1.1486 on Friday, and traded at $1.1594 at 10:15 a.m. in London.",0.6811816
( cause to ) happen at a later time,provoke or stir up .,0.68208736
a man guts a fish .,the man used a chopper to chop the onion .,0.68302214
cause to be perplexed or mentally confounded .,this sounds a bit unusual .,0.6838457
take in ( mentally or physically ),loss of ability to function normally .,0.6848524
discipline in personal and social activities .,free from obligations or duties .,0.6857201
how do i install a new interior partition wall ?,meshed frame over windows and doors,0.68665904
""" the electrical state difference between the battery "" "" s two terminals """,connected to the negative terminal,0.68759185
Someone is cutting a piece of meat.,the man used a chopper to chop the onion .,0.6885222
the white and brown dog is running quickly through the grass .,two gray dogs run together over the green grass .,0.6893791
a man is climbing a rope .,A man is diving into a pool,0.69032264
a man is playing the piano .,a cat is playing a piano .,0.6912223
"deliver a sharp blow , as with the hand , fist , or weapon ;",give suck to ; receive suck .,0.69213706
because an open switch creates a gap .,bulbs b and c remain in a closed path with the battery,0.69312316
the ability to recall things,a possible use for a vector space model is for retrieval and filtering of information .,0.69398564
"train , tutor or polish social behavior , taste , judgement",discipline in personal and social activities .,0.6948947
The brown animal is jumping in the air,a brown and white dog is running across a brown field .,0.695829
a sudden ( emotional ) outburst .,becaquse there was a gap in the connection,0.6967325
a dog is running along the grass .,two gray dogs run together over the green grass .,0.6976143
a dog biting on a can .,a white curly haired dog runs with a stick in it 's mouth .,0.6985112
Somebody is playing the guitar,a man is playing the piano .,0.6994638
be adjacent or come together ;,"come upon , attack or catch someone or something unaware",0.70036703
become quiet or still ; fall silent .,"expose to air as to cool , freshen , or allow to escape .",0.701165
Women are dancing outside.,a woman is dancing by a fire .,0.7022108
not connected to positive battery,terminal five is connected to the positive battery terminal .,0.7031531
This gives you the opportunity to make your case that you really do have expertise in XXX.,make clear and ( more ) comprehensible .,0.7040266
unrestricted freedom to use something .,the choice of mode of use and requirements of the future owner .,0.70493865
A man is not riding a bicycle,There are no men sawing,0.70576125
provide or supply with water,give away something that is not needed,0.70676
A woman is talking to a man,a woman with her child .,0.70769125
bulb a has a closed pathway,bulbs b and c are contiained in the the same path with the battery .,0.7085982
signify or mean to express or convey,complain about something or say mean things to someone .,0.70955944
a white and brown dog is playing tug-o-war .,a brown and white dog is running across a brown field .,0.71043456
A man is talking,man on steps,0.71111715
a woman is cutting a lemon .,a woman is cutting a jalepeno .,0.71232486
a man is eating a food .,a man puts some cheese on a pizza .,0.7131737
The person is flying through the air on the bicycle,A woman is performing a trick on a ramp with a bicycle,0.7140403
"several different ways of computing these values , additionally known as ( term ) weights , have been developed .",dynamic programming solves problems by combining the solutions of subproblems .,0.7150767
Green and white bird perched on tree branch.,The black bird is not sitting in a leafless tree,0.7159528
this frame describes a general situation in which an owner either increases or decreases their amount of a possession. the increase or decrease may either be physical or metaphorical .,the reduction of something 's value or worth .,0.71678334
provoke or stir up .,unite or merge with something already in existence .,0.7178805
a dog jumps off the stairs .,A black dog is jumping out of water.,0.7185909
Someone is cutting a piece of meat.,a woman is cutting a jalepeno .,0.71949947
take in ( mentally or physically ),come into the possession of .,0.72043127
because an open switch creates a gap .,the bulb is contained in an closed circuit,0.72139424
two terriers play on the wood floor of their home .,two dogs playing by the shore .,0.7223769
a woman is cutting a lemon .,A woman is slicing garlics.,0.7231513
bulb a is in a closed circuit with the battery without the y switch .,a damaged bulb creates a gap in the path,0.7242253
bulb a is in a closed circuit with the battery without the y switch .,because an open switch creates a gap .,0.7249984
An animal is playing with a small bottle,Someone is cleansing an animal,0.72588664
man on steps,a man is opening a door .,0.72682786
A man is doing some tricks with a soccer ball,A man in a red shirt is doing a trick with a skateboard,0.72770435
bulbs b and c remain in a closed path with the battery,""" the electrical state difference between the battery "" "" s two terminals """,0.7287572
the conclusion of a communication,the breakup or termination of a social relationship,0.7296269
There is no cat eating corn on the cob,The cat isn't licking milk from a saucer,0.7305615
There is no man on a bicycle riding on the beach,A man is not riding a bicycle,0.73159325
bulb b did not create a gap in the path for bulb a and c,circuit 2 is not a short circuit because is shows connection to the bulb .,0.7324967
There is no bicyclist jumping on a pyramid-shaped ramp,No motorcycle racer is riding a red and black bike,0.73314655
the terminal is connected to the battery,bulbs b and c are contiained in the the same path with the battery .,0.73416656
a girl is playing a guitar .,the girl sang into a microphone .,0.73520166
circuit 2 is not a short circuit because is shows connection to the bulb .,bulbs b and c are contiained in the the same path with the battery .,0.7360462
become quiet or still ; fall silent .,( cause to ) become less tense ; rest or take one 's ease .,0.73693687
take in ( mentally or physically ),move into and stay in a particular position,0.7377051
"incite action , cause an event","come upon , attack or catch someone or something unaware",0.73879766
""" the electrical state at the terminal matches the battery "" "" s electrical state """,bulbs b and c remain in a closed path with the battery,0.7397193
take in ( mentally or physically ),take into one 's family or group,0.7405383
come into the possession of .,provoke or stir up .,0.74132526
a range of mental vision ;,the ability to recall things,0.74240464
the switch has to be contained in the same path as the bulb and the battery,is it possible to replace a switch with a receptacle ?,0.743207
the switch has to be contained in the same path as the bulb and the battery,circuit 2 is not a short circuit because is shows connection to the bulb .,0.7441295
bulb b did not create a gap in the path for bulb a and c,the bulb is contained in an closed circuit,0.7452154
The black dog is playing with the brown dog on the sand,two black dogs playing in the snow .,0.7459068
"if the switch and bulb are contained in the same path , the switch will affect the bulb .",bulb a is still contained in a closed path with the battery and switch x .,0.7468239
There is no window being cleaned by a man,There are no men sawing,0.7479201
A man is working on his farm.,The man is outside in the field.,0.74873763
A boy is riding a bicycle.,A boy is surfing and riding a wave,0.7496922
bulb a and bulb c are not contained in the same closed path,bulb a is still contained in a closed path with the battery and switch x .,0.75068223
edit so as to block the truth ; prevent distribution,prove or suggest to be false or incorrect .,0.7515064
bulbs a and c are still contained in closed paths with the battery,the bulb takes away the path .,0.7524415
bulb b did not create a gap in the path for bulb a and c,the positive terminal is not seperated from the gap,0.7533359
bulbs b and c remain in a closed path with the battery,a damaged bulb creates a gap in the path,0.7543522
"if the switch and bulb are contained in the same path , the switch will affect the bulb .",because bulb b is damaged and does not allow the positive battery current to reach the other side .,0.75523883
There is no man on a bicycle riding on the beach,There is no man playing guitar,0.75614065
provide or supply with water,provide housing for .,0.75700635
a woman is adding sauce to some food .,a woman is mincing some garlic .,0.7579468
because an open switch creates a gap .,becaquse there was a gap in the connection,0.75883675
A flute is being played by a girl,A flute isn't being played by a man,0.7598662
bulb a has a closed pathway,bulb a will burn out with bulb c,0.7606437
a young girl swinging off a tire swing,A blonde haired toddler swinging on a tire swing.,0.76161575
bulb a is in a closed circuit with the battery without the y switch .,the bulb takes away the path .,0.76252973
"if bulb a burns out , bulbs b and c are still in a closed path",bulb a is still contained in a closed path with the battery and switch z .,0.7633972
A woman is being massaged by a man,A woman is talking to a man,0.76422095
train gliding on tracks .,"the train comes down the track , between two rows of trees .",0.7651932
The train is riding on the tracks in the snow.,A black train moves down the tracks.,0.7660662
two dogs running in the dirt,two gray dogs run together over the green grass .,0.76709735
a dog jumps through a hoop .,A dog is jumping on a trampoline,0.76804596
be adjacent or come together ;,provoke or stir up .,0.7687232
There is no man loading a rifle with bullets,There are no men sawing,0.7698484
move in a group or flock,move into and stay in a particular position,0.770774
a woman is mixing ingrediants .,a woman stirs eggs in a bowl .,0.77164143
Someone is beautifully playing the piano,A musician is playing two keyboards,0.7723663
bulb a is still contained in a closed path with the battery and switch z .,bulbs b and c are contiained in the the same path with the battery .,0.77337414
A woman is slicing garlics.,a woman slices a lemon .,0.7746988
bulb b did not create a gap in the path for bulb a and c,bulbs b and c are contiained in the the same path with the battery .,0.7748455
the bulb takes away the path .,bulb a and c are contained in different paths with the battery,0.77640676
three boys playing soccer in a field,Three boys are running.,0.7771952
make a certain noise or sound .,become quiet or still ; fall silent .,0.7780559
bulb a is still contained in a closed path with the battery and switch x .,bulbs b and c are contiained in the the same path with the battery .,0.77946335
a woman stirs eggs in a bowl .,A woman is taking a mixture out of a bowl,0.77985585
the switch has to be contained in the same path as the bulb and the battery,"if bulb a burns out , bulbs b and c are still in a closed path",0.7811441
the young boy is jumping into the pool on his belly .,"A boy, who looks young and is wearing a red swimsuit, is jumping into a blue kiddies pool",0.78161824
because bulb b is damaged and does not allow the positive battery current to reach the other side .,bulbs a and b are not within the same path as bulb c .,0.7825727
a woman is mixing ingrediants .,Some food is being fried by a woman,0.78336346
"if the switch and bulb are contained in the same path , the switch will affect the bulb .",bulbs a and b are not within the same path as bulb c .,0.7843498
The person is slicing a clove of garlic into pieces,a woman is mincing some garlic .,0.7858797
"the train comes down the track , between two rows of trees .",A black train moves down the tracks.,0.7862149
Someone is cutting a piece of meat.,A person is slicing onions.,0.7872613
bulb a is in a closed circuit with the battery without the y switch .,bulbs a and c are contained in different paths with the battery .,0.7880457
A woman is slicing garlics.,A person is slicing onions.,0.7892724
A woman is cooking something in a pan,Oil is being poured into a skillet by the woman,0.7900204
A flute is being played by a girl,A large flute is being played by a man,0.7906722
Some food is being fried by a woman,a woman is adding sauce to some food .,0.7918253
A woman is cooking something in a pan,a woman is adding sauce to some food .,0.7920593
""" the electrical state at the terminal matches the battery "" "" s electrical state """,the negative battery terminal is seperated by a gap from terminal 1 and 2,0.79284024
a dog is running along the grass .,a brown and white dog is running across a brown field .,0.79325354
"if the switch and bulb are contained in the same path , the switch will affect the bulb .",the bulb is contained in an closed circuit,0.793342
an open switch causes a gap .,becaquse there was a gap in the connection,0.7951522
train gliding on tracks .,The train is riding on the tracks in the snow.,0.7952534
Someone is cutting a piece of meat.,The person is quickly slicing a vegetable,0.79541576
unrestricted freedom to use something .,free from obligations or duties .,0.7957281
The person is slicing a clove of garlic into pieces,A person is slicing onions.,0.7959657
There is no woman slicing a tomato,There is no woman adding spices to some meat,0.79663235
"if the switch and bulb are contained in the same path , the switch will affect the bulb .",the bulb takes away the path .,0.7970369
bulb a is in a closed circuit with the battery without the y switch .,because bulb b is damaged and does not allow the positive battery current to reach the other side .,0.7977604
this dog is jumping through the water .,a dog jumps into a backyard pool .,0.7978563
Two women sitting in chairs in a shop.,two women in a clothing store .,0.79819787
two women sitting in chairs in a shop .,two women in a clothing store .,0.79819787
some people are dancing on stage .,a band is playing on stage .,0.7982901
someone is slicing a tomato .,a man is slicing something .,0.7993144
bulbs a and c are still contained in closed paths with the battery,bulbs a and b are not within the same path as bulb c .,0.79932123
mandela remains in hospital,nelson mandela goes home after hospital stay,0.7996035
the bulb is contained in an closed circuit,bulb a is still contained in a closed path with the battery and switch z .,0.79966974
The person is peeling an onion,a woman is cutting onions .,0.8001315
bulb a will burn out with bulb c,bulb a and c are contained in different paths with the battery,0.8004014
A man is putting some food in a container,a man puts seasoning in a bowl of water .,0.8021457
bulbs a and b are still contained on a closed path with the battery,bulb a and bulb c are not contained in the same closed path,0.8026224
bulbs a and c are still contained in closed paths with the battery,bulb b did not create a gap in the path for bulb a and c,0.803022
The man is chopping a tree trunk with an axe,One man is chopping a log with an axe,0.80331755
bulbs a and c are still contained in closed paths with the battery,the bulb is contained in an closed circuit,0.8041061
bulbs a and b are still contained on a closed path with the battery,the bulb is contained in an closed circuit,0.80423063
the bulb is contained in an closed circuit,bulb a and c are contained in different paths with the battery,0.80436736
Someone is cutting a piece of meat.,someone is slicing a tomato .,0.8044299
the bulb is contained in an closed circuit,a damaged bulb creates a gap in the path,0.80445594
"if bulb a burns out , bulbs b and c are still in a closed path",a damaged bulb creates a gap in the path,0.8044757
A man is punching a soccer ball,A man is doing some tricks with a soccer ball,0.80455
A woman is slicing garlics.,a woman is cutting onions .,0.8048673
A man is talking,A woman is talking to a man,0.8049489
bulbs a and c are contained in different paths with the battery .,bulb a is still contained in a closed path with the battery and switch z .,0.8049516
A woman is talking to a man,A man in a white shirt and blue pants is talking with a woman in a pink shirt.,0.8050332
bulb a has a closed pathway,the switch has to be contained in the same path as the bulb and the battery,0.805113
"with all precincts reporting , fletcher — a three-term congressman from lexington — had an overwhelming 57 percent of the vote .","with all precincts reporting , fletcher had 88,747 votes , or 57 percent of the total .",0.80526423
bulbs b and c remain in a closed path with the battery,because bulb b is damaged and does not allow the positive battery current to reach the other side .,0.8060461
An animal is playing with a small bottle,The dog is licking a bottle,0.80623597
a mercantile establishment for the retail sale of goods or services .,a retail store with merchandise for sale,0.80647266
the terminal is connected to the battery,""" the electrical state difference between the battery "" "" s two terminals """,0.8065428
bulbs a and c are contained in different paths with the battery .,bulb a is still contained in a closed path with the battery and switch x .,0.8072164
an open switch causes a gap .,the switch has to be contained in the same path as the bulb and the battery,0.8072391
A man is sprinkling seasoning on several sliced and buttered loaves of bread,a man puts seasoning in a bowl of water .,0.8073464
bulb a is in a closed circuit with the battery without the y switch .,bulbs a and b are still contained on a closed path with the battery,0.80756605
bulbs a and c are contained in different paths with the battery .,"if bulb a burns out , bulbs b and c are still in a closed path",0.80781066
the state of being angry .,a sudden ( emotional ) outburst .,0.807939
the terminal is connected to the battery,connected to the negative terminal,0.8080118
the bulb is contained in an closed circuit,bulb a is still contained in a closed path with the battery and switch x .,0.80803686
Two dogs running on the shore.,two dogs running in the dirt,0.8080518
Some food is being fried by a woman,A woman is cooking something in a pan,0.8086051
bulbs a and c are contained in different paths with the battery .,bulb a and bulb c are not contained in the same closed path,0.8087056
A person is slicing onions.,someone is slicing a tomato .,0.80910325
the man played his guitar with a friend .,Somebody is playing the guitar,0.80922365
bulb a has a closed pathway,bulb a is still contained in a closed path with the battery and switch z .,0.8098447
bulb a is in a closed circuit with the battery without the y switch .,bulb a and c are contained in different paths with the battery,0.8100886
bulbs a and b are still contained on a closed path with the battery,because bulb b is damaged and does not allow the positive battery current to reach the other side .,0.8104095
bulb a has a closed pathway,bulbs a and b are still contained on a closed path with the battery,0.81118506
bulb a has a closed pathway,bulb a is still contained in a closed path with the battery and switch x .,0.8112064
A person is slicing onions.,a man is slicing something .,0.8115334
bulb a has a closed pathway,bulb a is in a closed circuit with the battery without the y switch .,0.8116581
"if bulb a burns out , bulbs b and c are still in a closed path",bulbs b and c are contiained in the the same path with the battery .,0.8124813
bulbs a and c are still contained in closed paths with the battery,bulb a is in a closed circuit with the battery without the y switch .,0.81301665
The person is flying through the air on the bicycle,A cyclist is performing a jump on a bicycle,0.81315714
bulbs b and c remain in a closed path with the battery,the bulb is contained in an closed circuit,0.8138408
A person is not making a bed,A man is not riding a bicycle,0.81456465
the bulb takes away the path .,the bulb is contained in an closed circuit,0.81459385
the terminal is connected to the battery,the negative battery terminal is seperated by a gap from terminal 1 and 2,0.8148189
this dog is jumping through the water .,A dog standing in the water.,0.8148859
a man is playing the piano .,a man is playing a key-board .,0.8154269
bulb a has a closed pathway,bulb a and c are contained in different paths with the battery,0.8155639
a panda is climbing .,a panda is sliding down a slide .,0.81576777
bulb b did not create a gap in the path for bulb a and c,bulbs a and b are still contained on a closed path with the battery,0.8161415
"if bulb a burns out , bulbs b and c are still in a closed path",bulb a and c are contained in different paths with the battery,0.8169308
A man is putting some food in a container,A man is removing some food from a box,0.8171372
bulb a has a closed pathway,bulb b did not create a gap in the path for bulb a and c,0.81739515
bulb a is still contained in a closed path with the battery and switch x .,bulb a and c are contained in different paths with the battery,0.8177894
bulb a and c are contained in different paths with the battery,bulb a is still contained in a closed path with the battery and switch z .,0.81855136
the negative battery terminal is seperated by a gap from terminal 1 and 2,""" the electrical state difference between the battery "" "" s two terminals """,0.8190154
"if the switch and bulb are contained in the same path , the switch will affect the bulb .",a damaged bulb creates a gap in the path,0.81919897
No motorcycle racer is riding a red and black bike,No motorcycle rider is standing up on the seat of a motorcycle,0.81924105
bulbs a and c are contained in different paths with the battery .,bulbs a and b are not within the same path as bulb c .,0.819433
the white and brown dog is running quickly through the grass .,a brown and white dog is running across a brown field .,0.82006574
a woman is mixing ingrediants .,a woman is adding sauce to some food .,0.82034564
bulb b did not create a gap in the path for bulb a and c,a damaged bulb creates a gap in the path,0.8204702
bulb a is in a closed circuit with the battery without the y switch .,bulbs b and c remain in a closed path with the battery,0.821811
